,rating,time,content,label
868,평점5,21.02.25.,촉촉하고 아주 만족합니다,1
869,평점5,21.03.10.,효과가 좋앗으면 좋겠어요,1
870,평점5,21.03.12.,잘쓰고 있고 잘케어됩니디,1
871,평점5,21.02.26.,"재구매입니다
넘좋아요",1
872,평점4,21.03.17.,사용 전입니다. 입소문 듣고 구매했는데 효과가 있ㄱㅣ를 기대합니다,1
873,평점5,21.03.09.,좋아요 재구매했어요,1
874,평점3,21.03.17.,효과 잘 모르겠네요~~,0
875,평점4,21.03.15.,스킨팩으로 사용해요,1
876,평점5,21.02.26.,너무 좋은거 같아요,1
877,평점4,21.02.23.,상품평이 좋아서 구매했어요. 딸 여드름에 효과 있었으면 좋겠어요.,1
878,평점5,21.02.11.,사용한지 한달이 조금 넘었는데 아직까지는 크게 좁쌀여드름이라던지 모공케어라던지 큰 효과는 못 봤어요 그래도 산뜻하게 사용하기에 좋고 예전보다는 트러블이 덜 난다는 느낌을 받아서 앞으로 꾸준히 사용할 거 같아요!,1
879,평점5,21.02.14.,진짜 너무 좋아요! 이거쓰고나서 피부진정이 많이 된것 같아요!!,1
880,평점4,21.03.16.,종아요 효과있어요 잘쓰고있어요,1
881,평점5,21.02.20.,중학생.딸이 이마에 여드름이.올라와서 구입했고 저도 계속 마스크라인으느 좁쌀이심해서 좋다는.소문듣고 구매했는데 아직은.크게는.모르겠어요,1
882,평점5,21.02.25.,"여드름때문에 이래저래 고생하는 중딩 아들딸들때문에 구입했습니다.
다른분들처럼 잘 잡혔으면 좋겠습니다.",1
883,평점4,21.02.19.,"사춘기 시작된 아들을 위해~
조금 따가워하네요.사용3일째인데 여드름이 줄어든 느낌은 아직 없어요.
상품평 좋으니 꾸준히 써봐야겠죠~^^",1
884,평점3,21.03.01.,"ㅇㅏ이들 피부땜에 샀어요
아직 효과는 모르겠어요",0
885,평점5,21.03.14.,딸아이 때문에 구매했어요~ 효과가 있으면 좋겠어요^^,1
886,평점5,21.02.16.,"얼굴이 많이 좋아졌어요.
화농성여드름과 좁쌀여드름이 온 얼굴을 뒤덮고 있었는데, 많이 좋아졌어요.
완벽하게 없어지는 그날까지 주~욱 써보는걸로요^^",1
887,평점5,21.01.20.,"배송은 보통이였고 조금 비싼감은 있지만 후기들 믿고 구매했습니다
열심히 써보고 효과 좋으면 추가로 다른 제품들까지 구매해보려합니다
잘쓸께요 ^^ 번창하세요",1
888,평점5,21.02.25.,사춘기 아들 주려고 샀는데 마스크 때문에 턱주위에 저도 트러블 생겨서 잘 쓰고 있습니다! 몇일 안 썼지만 좀 덜 한것 같아요^^,1
889,평점3,21.02.22.,"아직은 더 사용해 봐야 알 것 같아요
워낙 평이 좋아 코에 블랙헤드랑 여드름 나기 시작하는 딸에게 필요한듯해 구매했어요
효과있었음 좋겠어요",0
890,평점5,21.02.19.,초5학년 아이쓰려고샀어요. 요새 트러블이 자주 생기는데 좁쌀여드름인지 확실치는 않네요. 사용후 후기 남길예정임. 효과있었음 좋겠네요,1
891,평점4,21.03.12.,잘 받았습니다. 뽀얀 아이얼굴을 기대해 봅니다!,1
892,평점4,21.02.04.,초등학생 좁쌀 여드름에 사용하려고 주문했어요. 쓰기 편해서 잘 사용합니다. 아직 사용한지 오래되지 않아 크게 나아진건 모르겠지만 트러블은 없네요.,1
893,평점4,21.03.05.,"촉촉하고..
아직은 트러블이랑 모공은 잘모르겠으나
메디큐브 파란뚜껑보단 덜끈적이고 첫느낌이 좋았어요",1
894,평점5,21.03.03.,"사용하기에 너무 편하고
사용하고 나서 며칠 지나보니
피부가 매끄러워졌어요.",1
895,평점4,21.02.06.,처음에는 트러블이 들어가고 효과가 있엇어요. 촉촉하고 스킨케어 하기전에 잔여물 없앨수있어사 좋아요,1
896,평점5,21.02.17.,"초딩 딸램이 여드름 때문에 주문
배송 넘 오래 걸렸어요..
일단 사용해 보고 한달 리뷰 다시 올리겠습니다",1
897,평점5,21.03.26.,좋아요아주그냥좋아요,1
898,평점5,21.02.18.,처음으로 사용해서 해봤는데 붉은기도 가라앉는 듯 해서 좋아요..토너도 좋고 클렌징도 거품잘나서 부드러워서 만족합니다.,1
899,평점5,21.02.04.,아들 써보고 좁쌀 여드름에 효과 있어서 조카 선물하려고 또 구매했어요. 자극적이지 않고 순해요.,1
900,평점5,21.02.26.,초등학생 딸아이 얼굴 트러블 심할때 사용중 입니다. 저도 써봤는데 순하고 자극적이지 않않아요,1
901,평점5,21.02.16.,"딸래미 이마에 조금씩 좁쌀만한것이 나와서 후기보고 구매해봤어요.믿고
꾸준히 사용해볼께요",1
902,평점4,21.02.27.,사용한지 한달정도 되어가는데 바르면 촉촉해서 좋긴한데 트러블케어는 전혀안되는것같아요,1
903,평점5,21.02.16.,"아들얼굴에 트러블 생겨서 산건데...
몇일 안썼지만 만족합니다~
꾸준히 쓰면 더 좋아지겠죠??~~",1
904,평점5,21.02.16.,"토너로 쓰다가 패드 나왔다고해서 주문했어요
2+1으로 저렴하게 샀고 포장도 꼼꼼하니 좋네요",1
905,평점5,21.03.06.,"일단 잘 쓰고 있어요 더 써보고 자세한리뷰해볼게요 제발 우리아이 피부가 진정되길바라며,,",1
906,평점5,21.02.24.,확실히 이 제품을 사용하고 나니깐 좁쌀도 관리가 되고 유분기도 많이 사라지는 느낌이에요~,1
907,평점5,21.03.10.,잘받았습니다 아직 사용전입니다,1
908,평점4,21.02.19.,아직 잘 모르겠지만 여드름에 좋다해서 써봐요 패드가 생각보다 많이 촉촉하진 않아요.....,1
909,평점5,21.02.17.,아누아 토너써보구 좋아서 이것도 써보고싶었음 좋아요,1
910,평점3,21.02.23.,피부자극은 없으나 효과는 잘 모르겠어요 붙이고 나서 조긍 있으면 말라서 떨어지네요...,0
911,평점5,21.02.20.,배송 빨라서 좋아요. 상품은 아직 이틀밖에 안 써봤지만 적당히 촉촉해서 마음에 듭니다.,1
912,평점5,21.01.21.,초등학교 고학년 아이 좁쌀여드름 케어해주려고 사용하고 있는데 차차 좋아지는 것 같습니다. 꾸준히 사용하면 더 효과를 볼 것 같아요.,1
913,평점5,21.03.03.,중1아들 얼굴에 트러블이 나기 시작해서 클렌징도 바꾸고 화장품도 바꾸고해도 별 효과가 없었는데 이 제품은 사용하자마자 효과가 보이네요 두번째구매입니다,1
914,평점5,21.03.02.,초6 남자아이 좁쌀 조금씩 보이는거 같아 주문했어요~ 아직은 사용초기라서 잘 모르겠지만 일단 아이가 혼자 닦토하듯 잘 사용합니다~,1
915,평점5,21.03.14.,첫날 붙였어요~~ 좋아졌음 좋겟어요,1
916,평점4,21.03.06.,처음엔 닦을땜 따끔한데 다음날 아침에 얼굴에 광이나네요 일단 좀 더 써보겠습니다^^,1
917,평점5,21.02.23.,오늘 받아서 사용하는거라 아직은 잘 모르지만 효과있길 빌어요 한달 후기 올릴께요^^,1
918,평점4,21.02.17.,딸 좁쌀여드름때문에 두통째 구입했는데 좀 나아진것같아요 꾸준히 써볼생각이에요,1
919,평점5,21.03.04.,중등남자아이 이마에 써볼라구 구매했어요~~아직 써보진 않았지만 기대되내요~~^^ㅎ,1
920,평점3,21.03.04.,"오늘 받아서 다 보통으로 했어요
초5 딸아이와 같이 써보려고 샀어요^^
한달 정도 써 보고 다시 리뷰 쓰러올께욤..!!^^",0
921,평점5,21.01.20.,"중딩 딸램..한번 사용했어요~~...첨 느낌은 좋다네요~~^^
여드름 피부라..피부과도 계속 다니지만..잔잔한 좁쌀여드름은 늘..올라와서 한번써보려구요~~꾸준히 써보겠습니다~~~ㅎㅎ",1
922,평점5,21.01.20.,중1 딸아이 이마 여드름때문에 구매 했어요. 후기 보고 주문했는데...정말 많이 진정되고 깨끗해 지는게 보이네요. 가격이 좀 비싸지만 피부과 가는거 생각하면 비용도 그렇고 집에서 캐어할 수 있어서 좋은 것 같아요.,1
923,평점5,21.03.01.,"좁쌀때문에 난리였는데
요 패드 덕분인지 그쯤 바꾼 다른 화장품들 덕인지
좁쌀이들 사라졌어요~
그래서 재구매 합니다 ㅎㅎ",1
924,평점5,21.02.28.,화장솜이 조금만 더 부드러우면 더 좋겠어요 간편하게쓸수있어서 좋아요,1
925,평점5,21.02.06.,냉장고에 넣어서 시원하게 쓰고 있어요 일주일째 쓰고 있는데 피지든 좁쌀 여드름 크기가 줄고 있긴해요,1
926,평점5,21.02.23.,지금 딸아이 쓰고있고 아직 잘모르겠어요. 좀더 써봐야될거 같아요,1
927,평점5,21.03.01.,두번째 구매입니다. 딸아이랑 저랑 아주 잘쓰고있어요.촉촉해요~~~,1
928,평점5,21.03.12.,잘받았습니다 감사합니다,1
929,평점5,21.02.21.,"1개 구매하여 사용한 뒤에 효과가 있는 것 같아
3개 더 주문했어요.",1
930,평점5,21.01.31.,크게 기대안했는데 효과있는것같고 생각보다 더 순해서 만족해요,1
931,평점5,21.02.20.,패드가 두껍지 않도 촉촉해서 사용하기 좋아요~ 재구매 했습니다,1
932,평점5,21.02.17.,"초등아이 피부트러블로쓰고있어요
2통째입니다.괜찮은거같아요^^",1
933,평점5,21.02.17.,"아직사용전이요
아이좁쌀여드름때문에 주문요
효과좋았음 해요~",1
934,평점5,21.02.23.,오늘처음 처보는거라서 아직잘모르겠는데ᆢ좋다고하니 좋겠죠,1
935,평점4,21.03.05.,몇번 사용은 안했지만 후기처럼 촉촉하고 피부가 진정되네요,1
936,평점3,21.02.24.,"아직 잘 모르거니와 그냥 순하네요
메끈 해 지고는 일어서요",0
937,평점5,21.02.23.,자극없이 쓰고 싶어서 구매했는데 효과있었음 좋겠네요~~,1
938,평점5,21.02.20.,처음 쓴거라 아직 모르겠지만 좋을거라는 기대속에 사용합니다.중2 아들한테 효과가 좋길~,1
939,평점5,21.02.12.,좁쌀여드름이 많이 완화되었어요 꾸준히 써보려합니다,1
940,평점5,21.01.20.,진짜 광고처럼 딱 초4학년 딸아이 이마에 좁쌀여드름이 생겨 좋다는거 다써보고 마지막이란 생각으로 구매했어요 우선 향도강하지않고 이틀써봤는데 벌써 진정된느낌이란게 육안으로 보이네요 한달사용해보고 후기남길게요,1
941,평점5,21.03.03.,좋아서 또 쓰고 있어요. 앞으로 계속 쓸 제품이에요,1
942,평점5,21.02.16.,한달가까이 꾸준히 사용했는데 이것때문에 좋아진건지 무엇인지는 모르겠으나 트러블이 많이 없어지긴 했어요 없던 트러블이 생겨 스트레스였는데 많이 없어져서 좋아요,1
943,평점5,21.03.01.,순해서 아이가 쓰기에도 부담이 없어서 좋습니다.,1
944,평점4,21.02.23.,몇번써보진 않았지만 촉촉해지는것 같긴 합니다~,1
945,평점5,21.02.23.,"중1. 올라가는 딸아이주려구요
효과있길 바라며..",1
946,평점4,21.03.01.,아직은 특별한 부작용 없이 잘사용하고 있어요~~,1
947,평점4,21.02.28.,딸아이랑 같이 사용하려고 구매했는데 좋아요~~,1
948,평점4,21.03.03.,몇 일간 사용 해 봤는데 아직 효과는 안 보여요,1
949,평점5,21.03.06.,"냉장고에 넣어두고 시원하게
사용중입니다",1
950,평점5,21.02.22.,좁쌀에 그생하던 아이가 너무 좋아하네요.,1
951,평점4,21.02.26.,아직 사용한지 얼마되지않지만. 촉촉해온,1
952,평점4,21.02.19.,여드름이 나기시작한 아들위해샀어요 코에 나기시작해서 코를 집중닦아요 많이 번지질 않길바라며 열심히 닦네요 ㅋ,1
953,평점5,21.02.12.,좋습니다! 좁쌀에 확실히 효과 있어요,1
954,평점5,21.03.06.,중딩 아들 좁쌀 캐어 위해 구매했어요,1
955,평점5,21.02.28.,우연히 광고보고 주문했는데 좋네요.,1
956,평점3,21.02.23.,그냥 그저 그래요~아직 잘모르겠어요,0
957,평점5,21.01.05.,"사용한지 3일정도 되어서 아직은 큰 효과를 모르겠지만 트러블이 생기지 않고 좁쌀 여드름이 더 생기지 않는 것 같아요.
아직은 괜찮은 것 같아요.
더 써보고 여드름에 효과가 있으면 또 구매할께요.",1
958,평점3,21.03.05.,뭐 그럭저럭 무난하게 쓸만 합니다,0
959,평점5,21.03.02.,한장씩 꺼내쓰면되서 너무 편해요,1
960,평점5,21.03.05.,청소년이 두딸 잘 쓰고있습니다~~,1
961,평점4,21.02.18.,아들 여드름이 좋아진것 같아요,1
962,평점5,21.02.17.,다음날 촉촉하고 부드러웠어요,1
963,평점5,21.02.17.,좁쌀여드름이 가라앉아 좋아요,1
964,평점3,21.02.28.,역시 돈이 최고야 짜릿해 꺄륵,0
965,평점5,21.02.22.,"피지, 각질 없애기엔 최고예요",1
966,평점5,21.02.14.,아주 만족b 3개 한번에구매함,1
967,평점5,21.02.28.,한통 다 쓰고 재구매 했어요,1
968,평점4,21.02.22.,"딸아이 여드름 때문에 구매했어요
이틀 써봤는데 아직은 잘 모르겠어요",1
969,평점4,21.02.24.,꾸준히 쓰면 좋아지겠죠.,1
970,평점5,21.02.22.,패드 형태라 쓰기 편해요,1
971,평점5,21.03.01.,평이 좋아서 구매합니다,1
972,평점4,21.03.02.,좋아서 재구매했습니다~,1
973,평점5,21.02.26.,스킨을 계속 쓰고 있었는데 편하게 쓰고싶어서 구매해 봅니다.,1
974,평점5,21.02.17.,"딸아이가 늘 쓰는 제품이에요..
다른 제품보다 좋다고하네요.",1
975,평점5,21.02.23.,트러블이 나아지는지는 모르겠지만 순한거같아용,1
976,평점4,21.02.01.,사춘기 아이 여드름때문에 구매했어요.아직 효과는 잘 모르겠으나 세안 후 사용하면 잔여물들이 닦이는 듯 해서 그건 좋은것같아요,1
977,평점5,21.01.28.,"반신반의하며 여드름난 아들쓰려고 샀어여., 확실히 효과있어요..^^ 화장솜따로 할일없이 한장으로 케어하니 편하고 좋네용 ㅎ",1
978,평점5,21.03.13.,좁살 안나욘 ㅜㅜ 좋습니댱 ㅎㅎㅎ,1
979,평점3,21.02.08.,"드라마틱하진않고
악건성이라 좁쌀이 올라온듯한 아이 피부에 사용하니
따갑다고하더라구요
아직은 더 써봐야할듯합니다",0
980,평점5,21.02.17.,어성초 좋다는 얘기는 많이 들어서 반신반의 하며 산건대 너무 저한테는 잘 맞아요 세통째 쓰고 있습니다,1
981,평점5,21.03.06.,집게가 같이 있어서 ㅊㅓㅇ결하고 좋은 것 같아요!,1
982,평점5,21.02.22.,초등아이 좁쌀때문에 샀는데 처음쓸때 약간 자극이 간듯 싶어요 금새 가라앉았지만 순간 놀랬네요,1
983,평점5,21.02.19.,오늘 처음 써봐서 아직 잘 모르겠지만 일단 엄청 촉촉하고 좋은 것 같아요 꾸준히 써보겠습니다,1
984,평점5,21.02.14.,"사용한지 일주일 됐는데 .. 피부에 효과는 더 써봐야할것 같아여 .
패드라 편하고 좋아요 .",1
985,평점5,21.02.04.,초등6학년아들 이마여드름때문에 구매했어요. 세수하고 패드로 쓱쓱 닦는거라 간편해요. 효과가 좋으면 좋겠어요.,1
986,평점4,21.02.22.,배송은 4일 걸렸어요. 중간에 안내 한번 받았고요. 중학생 아이용가 사용할 예정입니다.,1
987,평점5,21.02.07.,뾰루지가ㅜ너무많이나서 후기가 좋아서 사봤습니다 효과가 좋으면 좋겟네요,1
988,평점4,21.02.02.,13살 민감피부 남자아이가 쓰기에 순합니다. 하지만 효과는 모르겠어요.^^;,1
989,평점3,21.01.19.,"아들 좁살 여드름때문에 샀는데 많이 줄어들었어요
꾸준히 써보고 싶네요",0
990,평점5,21.01.27.,딸아이가 이제 여드름이 올라와서 구매했는데 효과는 아직 좀 더 써봐야알것같아요. 저도 저녁에 세안하고 써보는데 촉촉한것같긴 해요~ 여드름에 효과 있으면 추후 구매할께요^^,1
991,평점5,21.02.20.,"재구매 상품입니다.
딸아이 이마 여드름에 효과있어 재구매합니다.",1
992,평점5,21.02.08.,일단더썹고구 리뷰남길께요~배송은 빠르게 잘도착해서 너무 좋아요~^^,1
993,평점4,21.01.19.,초4아들 좁쌀 중2딸램 여드름때문에걱정이어서 주문해봤어요 아들볼피부가 좋아지는거같아요,1
994,평점5,21.02.04.,"배송빠르게 받았네요~
딸아이 이마 좁쌀여드름이 없어지길 바라며^^",1
995,평점5,21.02.07.,아들 여드름에 효과있으려나 했는데 3일 써봤는데 붉은기가 많이 사라졌어요. 꾸준히 써보려구요,1
996,평점4,21.02.01.,"사용중으로
한달써보고 후기 남길게요.
꼭 여드름이 사라지길~~",1
997,평점4,21.01.05.,"향도 괜찮고 촉촉한 느낌도 좋은거같아요
꾸준히 써보고 트러블도 개선되길
다만 다른 브랜드 패드제품들은 집게를 캡 아랫부분드ㅇ에 보관할 수 있게 되어 있는데 이 제품은 그냥 따로 달랑 들어있어 좀 아쉽네요ㅠ",1
998,평점5,21.02.20.,"얼굴이 깨끗해지느낌
3일정도 되니 좁쌀이 줄어드는거 같아요",1
999,평점4,21.02.06.,다른것 써보다가 써봤는데 생각보다 괜찮아요. 솜이 살짝 작아서 좀 더 컸으면 좋겠어요 이제 한통 다 쓰고 한통 남았는데 재구매 할까 생각중이랍니다.,1
1000,평점3,21.02.08.,시원한데 트러블에효과적이진 않아요. 잘 안쓰게 되네요.,0
1001,평점4,21.02.19.,하고나면 피부가 땡기게 느껴지는건 기분탓인가요ㅜ,1
1002,평점4,21.02.16.,집개를 우겨 넣었는데 보관할 틈이 있음 좋겠네요,1
1003,평점4,21.02.08.,꾸준히써봐야알겠지만 스킨대신쓰기 편하긴해요,1
1004,평점4,21.02.09.,여드름이 심해서 좀더사용해봐야할거같아요..,1
1005,평점5,21.02.13.,등드름 가슴 여드름 샤워후 닦아내니 여드름이 덜 나는듯 합니다,1
1006,평점2,21.05.05.,"좁살트러블에 효과가 있다고 하던데
저한텐 그닥 별 효과가 없네요
여전히 피부가 오돌도돌하고 그래요",0
1007,평점5,21.02.21.,"좋네요~~
근데 좀 패드가 껄끄러운더같아요",1
1008,평점5,21.02.05.,촉촉하네요~여드름에 효과있으면 좋겠어요,1
1009,평점5,21.02.13.,유투브 보고 샀는데 생각보다 더 좋네요,1
1010,평점5,21.02.02.,진짜 좁쌀 여드름 제거에는 최고에요!!,1
1011,평점5,21.02.14.,아직은 잘 모르겠지만 좋은듯 합니다,1
1012,평점4,21.02.14.,꾸준히쓰구있습니다 좀더써바야할듯,1
1013,평점4,21.02.19.,이마의 비립종이 조금 줄어든듯해요,1
1014,평점5,21.02.19.,재구매예요. 한번더 사용해보려고요,1
1015,평점4,21.02.05.,"늘쓰던건데
패드로되있어서편해요",1
1016,평점5,21.02.01.,초딩이 딸 사줬어요~기대 됩니다~,1
1017,평점5,21.02.19.,일단 한통 써봐야 알것 같아요,1
1018,평점5,21.02.04.,울딸 쓰는데 벌써 좋아지네요,1
1019,평점5,21.02.01.,여드름난 아들이 쓰고있어요.,1
1020,평점5,21.05.06.,효과면에선 좋았어요. .ㅋ 그런데 가성비차원에서도그렇고 화장솜으로 얼굴을 닦는건 미세스크레치가 생길수있다기에 토너만 사용하려구요. .팩용으론 굿이지만요. ㅋ,1
1021,평점3,21.02.17.,드라마틱한 효과는 글쎄요~~~,0
1022,평점4,21.02.08.,초등5학년 여드름때문에 고민해서 주문했어요 효과있었음 좋겠어요,1
1023,평점5,21.02.05.,"딸아이 여드름으로 처음 사 보았어요. 한번 써봤는데 아직까진 잘 모르겠어요.시원한 느낌은 난다고 합니다.트러블 없길 바라며 계속 사용해보려구요~
빠른 배송 감사합니다^^",1
1024,평점3,21.02.19.,어성초 효과있음 좋겠네요,0
1025,평점5,21.02.03.,정말 효과있고 편해요~~~,1
1026,평점5,21.02.02.,좁쌀여드름에 진짜 최고,1
1027,평점5,21.02.15.,기능으로 효과 보았어요,1
1028,평점5,21.02.09.,만족하며 사용중입니다,1
1029,평점5,21.02.02.,두툼해서좋네요. 만족,1
1030,평점5,21.02.16.,배송굿 상품굿 입니다,1
1031,평점5,21.02.04.,좋아요 잘쓰겠습니다,1
1032,평점5,21.04.30.,"중학생 아들 얼굴에 여드름이 나기시작해서 속는셈치고 구입했는데 완전 효과 짱 좋아요
이마는 반짝거릴 정도로 다 없어졌고 코부분도 피지가 확 줄은게 눈으로 확인될정도예요",1
1033,평점5,21.05.05.,초5딸과 40대 후반아빠 전반인 엄마 이렇게 3명이서 효과보고선 두번째 구입이네요~둔한 저희 신랑도 피부 트러블도 많이 들어가고 촉촉해졌다고 그러더라구요~,1
1034,평점4,21.02.09.,여드름에 좋네요..,1
1035,평점4,21.05.11.,초등 아들 이마랑 볼에 좁쌀처럼 많이 나서 속는셈치고 한번 써보자하고 샀는데 정말 효과 있네요 이마 좁쌀이 많이 없어졌어요 수분도 촉촉해서 패드 꾸준히 사용하면 피부 좋아질것 같아 기대중입니다,1
1036,평점5,21.01.28.,생각보다 피부에 닿는 면이 훨씬 더 부드럽고 순했어요! 트러블 있는 부분에 올려두고 다음날 보니까 진짜 좀 들어간 느낌이네요 만족해요!,1
1037,평점5,21.01.20.,초등학생 딸들이 갑자기 좁쌀 여드름이 이마에 나오기 시작했어요~의심반 기대반으로 주문했는데 배송은 쫌 걸렸구요 며칠 사용했는데 아직 효과는 잘 모르겠으나 아이들이 열심히 사용중입니다~^^,1
1038,평점4,21.02.09.,"사춘기 아들 얼굴에 자잘하니 오돌토돌 올라왔는데 패드 하고 나면 많이 사라져요
녀석이 자주 안해서 큰효과를 누리지 못하는 중이네요.",1
1039,평점5,21.03.23.,감사합니다 감사합니다 좋아요,1
1040,평점5,21.02.07.,토너패드를 많이 써봤는데 아누아토너패드는 도톰하고 토너액이 충분히 들어있네요 아주만족합니다,1
1041,평점3,21.01.28.,반정도 사용하기론 기대를 너무 해서 그런지 조금 실망. 통에 스킨은 흠뻑 적셔있어서 좋긴 한데 트러블에 호과는 없는거 같아요.,0
1042,평점5,21.01.31.,스킨팩으로도 사용하고 너무좋아졌어요. 자국만 남고 많이 없어졌어요.,1
1043,평점5,21.05.12.,한통쓰고 확실히 좋아짐을 느끼고 세통 더 구매했어요 아낌없이 팍팍 쓰려구요 가격좀 내려주세요 더많은사람이 쓸수있게요,1
1044,평점4,21.01.26.,"초등아들좁쌀여드름때문에
이라인으로모두구매했답니다
그런데..눈에확뛸정도의드라마틱한효과는
더사용해봐야할것같아요",1
1045,평점5,21.01.19.,"아이가 트러블 피부라서 여드름이 좀 완화
될까해서 주문했어요~ 열심히 사용해보고
좋아지면 재구매 할께요~",1
1046,평점5,21.01.19.,"아이가 여드름이 생겨서 구매했어요.
배송받고 바로 썼는데 좀 따갑다고 하네요.
보습 잘 하면서 써보려구요~",1
1047,평점5,21.01.08.,원래도 아누아 어성초 스킨 쓰고 있었는데 패드 사니까 밤에는 닦아낼 수 있고 너무 좋아요~~!! 강추입니당,1
1048,평점5,21.01.19.,한두번 썼다고드라마틱하진 않겠죠.수많은 후기가 증명해주고 있으니 믿고 꾸준히 사용해보려고합니다,1
1049,평점5,21.01.25.,"딸이랑 저랑 두통 사서 각각 나눠쓰고 있어요. 클리어패드 많이 써봤는데, 느낌은 이것이 가장 좋아요.!",1
1050,평점5,21.01.31.,일단 좋은게 느껴집니다 이걸루 팩도 하고 그래요 피부과 광이돌고 쫀쫀해져요 트러블도 가라앉겠죠?,1
1051,평점4,21.01.19.,오늘배송받고 아직써보진않아서 어떤지는몰라도 리뷰보고 구입한거라 믿고 써보려합니다 트러블에 좋다하여 구매했어요,1
1052,평점5,21.02.08.,배송은 정말 오래 걸렸지만...아이한테 3일째 사용하고 있는데 왠지 볼살이 더 부드러워진거 같아요,1
1053,평점5,21.05.10.,"광고글처럼 초5남아를 위해샀습니다.
이마에 좁쌀여드림이 쏙 들어갔어요
효과는 확실히 있는것 같습니다.
꾸준히 잘 사용하면 될거같아요~",1
1054,평점5,20.10.14.,저는 패드 이거만 쓰는데 적절하게 각질제거되고 촉촉하고 쿨링감이 있어요! 벌써 두통째입니다!,1
1055,평점5,21.01.28.,5학년 딸아이가 좁쌀 여드름이 심해져서 리뷰보고 구매해봤어요 사용전이지만 기대가 큽니다.,1
1056,평점5,21.01.30.,"액상이 맨윗부분까지도 촉촉히 적어있었고 패드도 자극이 없었습니다
그리고 집개도 주셔서 좀 더 위생적으로 사용할수 있어 좋았습니다",1
1057,평점5,21.01.29.,아직 써보진 못했지만 리뷰가 좋아서 구매해 보았어요 딸 여드름에 효과 있었음 좋겠네요,1
1058,평점5,21.04.23.,"좁살여드름이 더 늘어나지는 않고 지금 상태 유지중이요~
꾸준히 사용해 효과기대해봅니다~~",1
1059,평점4,21.01.22.,"좀 더 오래 써봐야 알 것 같아요
시원하게 잘 쓰고 있어요
효과 있으면 재구매의사 있습니다.",1
1060,평점5,21.02.18.,두번째구매에요 아직 딱 좋아진건모르겟지만 꾸준히써보려구요 두통째구매에요,1
1061,평점5,21.01.31.,2통째 사용중입니다. 패드라서 한장씩 꺼내쓰면되서 편하고 닦토로 사용중인데 세수하고 미쳐 닦여지지않은? 잔여물도 닦여지는 느낌이고 피부결 정리도 되는듯해서 좋아요.,1
1062,평점5,21.01.30.,"좁쌀여드름때문에 샀는데 효과는 잘 모르겠어요
세안후 닥토용으로 잘사용하고있습니다!!",1
1063,평점4,21.01.29.,"배송도 빠르고 가격도 저렴하게 샀어요.
용기에 비해 속에 패드가 너무 작아 별 하나 빼요",1
