,rating,time,content,label
0,평점5,21.05.06.,"와..저희 6학년 딸..
등에 너무 많이 나서,피부과 연고도 발랐지만
그때 뿐이더라구요.
연고를 계속 바르기에는 제가 너무 찝찝해서 어쩌지 하다가?이 제품 광고 하는걸 봤어요.
하도 광고하는 제품들을 사서 많이 당한지라..
이거 사서 썼는데,또 호구처럼 당하면 어쩌지?이 생각 하면서 두달을 고민 했어요.
두달 고민하다가 그냥 일단 사보자.안 맞으면 내가 써야지 하는 맘으로 샀네요.
근데 이게 무슨 일이죠?첫날 바르고 그 담날 보니
뭔가 줄어든거 같다?아닌가? 이 생각으로 열심히 닦고 발라줬죠.근데 진짜 저희 딸은 4일 뒤부터 효과가 확 나기 시작 하더라구요.
두번째 사진이 딱 4일째 사진 입니다.
지금은 사서 바른지 한달은 안됐지만,
진짜 .
정말 여자 아이라서 나중에 놀림 당할까봐 크게 걱정 했거든요.근데 여기 제품들 바르고 쓴 이후로 맘이 정말 편해지네요.
감사해요.많이 파시고,변함 없이 잘 만들어 주세요.",1
1,평점5,21.02.26.,한번 구매해서 써보고 너무 좋아서 다시 여러개 구매했어요~~ 친정집에 쓰던거가지고 가면 고등학생조카에게 뺏기고 오기를 두번째ㅎ 조카아이도 주문해줘야겠어요 사춘기라 피부과 다니는데도 트러블은 계속나고 그림그리는아이라 학원에서 4시간 이상 마스크를 착용하니 마스크로인한 트러블도 계속ㅜㅜ 요거써보더니 좋다고 합니다. 원래 제가 처음 구매하게된 계기는 10살 딸때문이었어요. 애기가..코로나로 마스크쓰니 볼에 좁쌀 여드름이 올라오더라구요. 아이가 쓸꺼라 순한성분 찾다가 우연히 써봤는데 좋더라구요 그뒤로 꾸준히 쓰고있어요. 11살이 된딸도 이게 좋다고 매일 사용하고요 마스크좀 오래쓴날은 양쪽볼에 팩처럼 올려놀고 누워서 책도 봅니다~~ 이제 저도 함께 쓰고있어요 신랑도 막 해주고요ㅎㅎ 저희가족에겐 필수품이 되어버렸네요 성분 좋은제품 꾸준히 만들어주세요~♡,1
2,평점5,21.03.14.,"초6딸 코피지,고1아들 얼굴,등,가슴에 여드*이 다 있는데 둘다 올초부터 피부에 관심을 보여 주문했습니다.이것저것 바르기 귀찮아하는 아들은 패그만 꺼내서 닦으니 간편해서 배송빋은 날부터 며칠은 꾸준히 사용응 잘 하고 스킨은 뿌리는 병에 담아서 등에 뿌려주고 있어요.
중1부터 계속 있던건데 이전에는 관심이 없고 제품사용도 잘 안하는데 역시 신경쓰기 시작하니 좀 낫네요.본인피부를 위해 신경써주셨음에 좀 고마워하고 ,개선의 효과도 많이 있으면 좋겠어요.
사용장점-간편해서 바르기 귀찮아하는 아이한테 좋고,향이 거의 없어 냄새에 민감한 아이한테 좋을거 같고요.마스크를 하루종일 착용하는 날 경과를 봐야겠지만 붉어진게ㅜ조금은 색깔이 어두어졌어요",1
3,평점5,21.03.06.,"초5따님.조금씩올라오기시작했는데.갑자기.큰게똭!!!!.우연히.네이버에서.발견하고.그냥사봤어요.윤스테#.정#미씨가.쓰는제품과.고민하다.요제품이.상품평에.아이들이.많이나오길래 ㅋㅋ
결과는.대만족.기존.좁쌀은.드라마틱하게.없어지진않았지만.좋아졌구요.뾰루지는정말.단박에.좋아졌어요.첫날과5일정도.사용한결과구요.전.아직.아이라.닦아내기보단.그자리에.올려두었어요.그래서.효과가.더있었던거같아요.어제부턴.아주살살.닦아내고있어요.혹시몰라.이틀에한번만.하려구요 ㅋㅋㅋ 저도.민감성이라.이틀에한번만.닦고있어요.현재로선.만족하고.쓰고있어요^^",1
4,평점5,20.10.10.,원래 스킨만 썼었는데 패드나와서 행사기간에 두개 주문했어용~~ 타브랜드 스킨패드로 나온더사용하면서 편해서 좋다고 생각했는데 아누아도 패드로 나와서 너무 좋아용~ 닥토용으로 패드쓰고 스킨으로 한번더 하니 너무 촉촉하고 좋아요 얼굴좁쌀도 진짜 많이 좋아졋어요 👍👍👍,1
5,평점5,20.10.14.,"너무 촉촉하고
스킨? 에센스? 굉장히 많이 적셔 있어서~ 토너 역할을 톡톡히 하네요!
요즘 마스크 때문에 턱에 트러블이 많이 나서 좋다는거 다해보는 중인데 ㅠㅠ 효과 있었으면 좋겠어요! 아직 2일 밖에 안되서 잘 모르겠지만 진정은 충분히 된거같아요!!",1
6,평점5,21.02.23.,"초4 피부과에서 이것저것 돈 많이 썼습니다.그때만 좋아지는듯 하다 다시 도루묵ㅜㅜ이마에 좁쌀 여드름이 잔뜩있는데 마스크를 쓰니 이마에 여드름만 보이고 스트레스가....그러다 우연히 알게 되어 리뷰보고 한번 써보자 싶어 구매하였는데, 사용한지 3일차 아침저녁으로 사용하고 있습니다.우선은 조금 좋아지는게 보여 꾸준히 사용해보고 한달후 다시 작성하여 올리도록할께요~",1
7,평점5,21.03.21.,"이마 트러블이 있는 초4딸에게 주려고 구입했어요. 카페에서 추천받고 사본건데 효과가 있었으면 좋겠네요. 3번정도 사용했는데 일단 자극없고 향기도 무난해서 아이가 아직은 잘 쓰고있어요. 한달 써보고 다시 후기 남길게요.
참고로 집게보관하는게 따로없어서 그건좀 불편하네요. (아비*쓰는데 그건 집게가 뚜껑안쪽에 부착되게 되어서 편하거든요)",1
8,평점4,21.04.27.,"아누아 토너 너무 잘써서 재구매하려다가 매번 화장솜 묻히는게귀찮기도 하고 패드도 리뷰가 좋길래 사봤어요
우선 이번에 화장품을 다 바꿔서 딱 이것때문인지는 모르겠지만 엄청 드라마틱하게 트러블이 좋아지는건 아니였어요 그래도 간편하고 피부결이 많이 부드러워진것같아서 좋은것같아요 하지만 별 하나 뺀 이유는 에센스?가많이 들어있지않고 딱 패드만 젖어있는 수준이고 패드도 통에 비해서 많이 작아요 또 가격이 살짝 부담돼서
저는 다 쓰면 토너 재구매할것같아요",1
9,평점3,21.01.08.,하루에 한 번+일주일정도 사용했어요 턱에 있던 도돌도돌 좁쌀들은 그대로입니다. 상큼하게 건조되는건 아니고 뭐랄까 토너가 얇은 막처럼 피부에 덮인 느낌이 남아있어요. 광고효과 보고 두개살까 하다가 하나사보길 잘한듯요. 사용 중지할정도로 기대감이 없진 않아서 조금더 써보고 트러블케어가 되는것같으면 더 사러 올게요. 참..배송에 친환경 포장 사용하셔서 보내주시는거 너무 좋습니다.,0
10,평점4,21.03.02.,"초등생 딸아이 이마에 좁쌀여드름이 나서 알아보다가 평이좋아 한번 써보려고합니다.
향은 아주 은은하거나 거의 나지않고 바르고나니 좀 당기는 느낌은납니다.
용기속에 스킨용액이 조금 더 들어가 있으면 좋을것같다는 생각이 듭니다.위에 부분이 좀 마를것같은 느낌이 드네요.
몇일 써본 딸 이마좁쌀 여드름이 조금 들어간것같기도하고 앞으로 계속 써보고 효과봤으면 좋겠습니다.",1
11,평점4,21.03.17.,"초민감이라 닥토가 안좋다지만
워낙 각질이 많이 쌓이고, 좁쌀을 달고사는지라 후기보고 구매했어요
광고나 후기보고 사는경우가 대부분이고, 순하다해도 매번 피부에 안맞아 화장품유목민생활하는중입니다
이것도 역시나 제피부에는 안맞는듯요
얼굴진정 좀 시켜볼까하고 팩처럼 얹어뒀는데 피부가 빨개져요
자극이 오네요ㅠㅠ
일주일에 한번씩만 사용해보렵니다
아 그리고 집게를 주는건 좋은데 따로보관할곳이 없어 안에다 넣고써요
뚜껑에 따로 집게통도 있었으면 좋으련만~",1
12,평점5,21.04.28.,"초등 5학년 딸래미가 여드름이 심해서 지인이 좋다고해서 구입했어요 장점은 세안후 닦아주는 패드라서 세안할때 세척이 안된 부분이 잘 닦이는것 같아요 그래서인지 때처럼 패드가 시커먼게 눈으로 보여요 단점은 많이 끈적여요 한달 써보고 77쓰기전, 후로 나눠 포토리뷰달께요",1
13,평점5,21.05.01.,"일단바르면 촉촉한데 스며드는 느낌은없고 시간이 지나면 맨들맨들 팩 씌워논것처럼 당기거든요..
원래그런거지.
근데 찝찝함이 있어도 며칠계속 써봤는데..피부가 좋아지는 느낌이 있어요..좁살은 아닌데도 볼록볼록 항상 얼굴표면이 울퉁불퉁했는데 나이지는거 같기도 하네요.ㅎ
3통샀으니 꾸준히 써보고또 남길께요..
그나저나 바르고 두면 당기는 팩한듯 쫙 당겨지는게 정상인가 궁금해요..제피부만 이런건지..",1
14,평점5,20.12.30.,"초딩 두 아들들이 급 좁쌀여드름이 볼에 많이 생겼어요. 첨엔 그냥 지나면 괜찮겠지 했는데 절대 안 들어가더라구요 ^^;;
피부과를 가자니 부담스럽고..... 그냥 두자니 너무 거슬리고... 원래 피부가 정말 꿀이었거든요 ㅠㅠ
그래서 인터넷 광고를 보고 좋다고 하고 어성초는 저도 소문으로 들었던 터라...
리뷰도 많이 읽어보고 한 번 사보자 하고 샀어요.
이틀 정도 얼굴 씻고 발라주고 잠깐이라도 얹어놔 줬는데 살짝 들어가기도 하는거 같아요~~
몇일 더 써보고 생각이 들어서 후기 올려봅니다.
더 써보고 정말 효과가 있음 좋겠네요~
기대됩니다~
저도 원래 쓰는 스킨사용 전에 한 번 쓱 닦아주는데 뭔진 몰라도 제 피부가 좋아지길 기대하며~~

아! 한장씩 되어있어서 좋긴 한데 약간 환경 걱정이 되기도 하구요 ^^;;;
그래도 한장씩 되어 있어서 좋긴 합니다 ^^",1
15,평점5,21.05.07.,세안제랑 토너 사용중이라 패드는 어쩌다 한번 썼어요. 트러블 많이 올라오던 초반에는 이마랑 코주변에 트러블부위로 패드를 붙이고있긴 했는데 요즘은 거의 다 들어가고 없어서 세안제랑 토너만 쓰거든요. 패드는 뭐 올라올때 한번씩 붙여주면 좋을거같아요! 진짜 저희딸은 초4에 여드름올라와서 피부과가서 약도 처방받아오고 했는데 약은 효과없었고 아누아덕봤어요ㅠㅠ 감사해요~,1
16,평점5,21.04.22.,"딸아이 샤워 후,에 항상 얼굴에 팩을 하는 편입니다 피부도 진정되고 너무 끈적이지도 않고 적당해서 너무 마음에 듭니다 좁쌀은 거의 없어졌구요 여드름 진정시키는 데는 단연 탑이라고 생각합니다 사춘기가 오고 나면 기름도 많이 지는데 그걸 잘 잡아주는 듯합니다 다음에도 또 재구매할 겁니다 몇 통을 쓰는지 저도 헷갈리네요 추천할게요",1
17,평점4,21.04.21.,2통 구매했어요 ! 중학생이 되니 딸아이 이마에 여드름이 나기 시작해서 … 어성초효과 기대하며 구매해봤네요 ! 아빠는 메디큐브제품쓰는데 ~ 비교해서 패드크기가 작고 잘 안떨어지네요 ! 하지만 수분감은 충만하고 향도 나쁘지 않은것 같아요 ! 꾸준히 써보고 아이가 효과보길 바래요,1
18,평점5,21.03.29.,"딸아이가 좁쌀이 너무 심해서 안써본게 없어요~ 비누,스킨등등 다들 정말 효과를 봐서 그리 리뷰를 올렸나싶은 의구심이 생기더라구요
진짜 진전이 없던 찰라에 요제품을 눈여겨봤습니다..근데 ..하루사이 좀 달라지는.ㅎㅎ앞으로 사용을 더 해봐야겠지만 좋아질꺼라 믿을꺼에요!!!우선 택배 포장부터가 믿음이 갔답니다..종이테잎에 종이완충재 환경을 생각하시는 포장법에서도 높이 평가해요..딸아이에좁쌀이 사그라들기 정말~~바래요",1
19,평점5,21.04.13.,한통다쓰구 너무 좋아서 또 구매했어요 패드형은 얼굴 자극이 잘 가서 다른 타제품도 사용해봤지만 다 실패했는데 어성초 77토너를 쓰구 피부가 너무 좋아지구 어성초77클리어패드 후기가 좋길레 반신반의로 사봤는데 너무 좋아서 놀랬어요 자극도 안가고 무엇보다 패드로 닥토하니까 피부결이 너무 좋아져서 놀랬습니다!!진짜 이 패드는 앞으로도 계속 사용하고 싶을만큼 효과를 봐서 동생도 같이 쓰는데 너무 좋다고 극찬해요!극 민감성이 제가 써도 좋을만큼이니 저같은 피부타입인 분들 사용해보시는 거 추천하고 싶어용!감사합니다!,1
20,평점5,21.05.10.,가끔 트러블 올라오는건 여전하구요..코에 몇개있는 검은피지도 아직 그대로에요..꾸준히 써야 효과를보는건지는 모르겠으나 재구매는 좀더 생각좀해보려합니다.같이온 집게는 아무쓸모가없네요^^;;제손톱이 길어서 살짝 집어빼쓰는게 더 편했다는...,1
21,평점5,21.05.09.,"세 번째 구매합니다. 초등학생 딸과 중학생 딸, 저까지 모두 사용해요. 스킨처럼 쓰다가 트러블 생기면 팩처럼 붙이는데 이삼일 하면 많이 좋아져요. 초등생 딸도 마스크를 쓰니 코부분에 좁쌀처럼 올라올 때가 있는데 꾸준히 해주면 좋아지더라구요. 앞으로도 잘 쓸께요~",1
22,평점5,21.01.05.,"5학년 아들 볼에 비립종인지 좁쌀 여드름인지가 넘 많아져서 반신반의하면서 주문했어요.
우와! 이거 진짜 효과있네요. 전/후 사진을 못 찍어서 보여드릴 수가 없는게 아쉬울 따름 입니다. 양 볼에 깨알같이 자잘하던 좁쌀들이 70%정도 가라 앉았어요. 효과 제대로 봤습니다.
자극은 아이한테 물어보니 물티슈로 얼굴 닦는 자극 정도래요. 따끔거리거나 아프진 않지만 자극이 아주 없진 않나봐요.
앞으로 계속 잘 써볼게요!",1
23,평점5,21.04.09.,"저렴하게 구매했습니다. 일단 다른 제품들도 닦토했던 것 보다 좋은 거 같아요. 보통 클리어패드들은 자극이 있는 것도 가끔 있었던 거 같은데, 아누아는 순하고 엄청 촉촉해요. 함께 들어있는 집게는 정작 집어야 할 아래부분이 벌어지지만.. ㅋㅋ 뭐, 복불복이었겠죠? 암튼 1주일 좀 넘게 쓰고 있는데 간편하고 맘에 듭니다. 마스크자극, 미세먼지로 자주 얼굴이 간질간질 한데, 트러블이 심해지지는 않는 거 같아요. 다 쓰고 재구매하려합니다.",1
24,평점5,21.01.29.,올해 6학년이된 아들 최근 볼에 좁쌀이 올라오기시작했어요ㅜㅜ 지금부터 관리잘해서 깨끗한 피부를 갖게해주고싶어 광고보고 주문했어요^^어제 도착해서 딱 한번써서 솔직히 아직은 잘 모르지만 꾸준히 사용해서 꼭 효과봤으면 좋겠어요~~,1
25,평점5,21.03.06.,"트러블케어에 효과를 잘 모르겠다고 고른거는 아직 사용한지 몇 일 안 됐기 때문이에요.
우선 이런 트러블 케어의 제품은 좀 건조하거나 뻑뻑한 면이 있는데 이 제품들은 부드럽고 순하다는 느낌이 강합니다.
자극없는 각질제거제 검색하다가 알게 됐는데 결국 여드름 나기 시작한 사춘기 딸 위해 구매 하게 됐어요.
무엇보다 자극 없어 사용하기 좋습니다.",1
26,평점5,20.12.30.,"아이가 11살인데 좁쌀이 자꾸올라와서
몸에도 퍼지더라구여ㅠㅠ
우연히 서핑하다 보고 왠지 끌리고 믿음이 가서 구매햇는데...
일주일정도 써보고 후기올립니다...
꼭 사세요... 두번세번 사세요...
저도 두통삿는데 다쓰면 또살꺼에요~~!!
좋다는 화장품 마니써봣는데 아무리해도 잘안없어져서 극기야 피부과까지 갓는데
로션하나에 4만원..
그거써두 큰효과못봣는데
요 패드 일주일사용하고 진짜 ..
진심꼭사세요.. ㅠㅠ
감사해여~~!! 울아이가 최고래요~~!!^-^♡",1
27,평점5,21.01.09.,"딸아이 이마에 좁쌀 여드름이 나서
주문했어요~
네이버 광고보고 주문하긴 했는데
효과 있었으면 좋겠네요^^
어성초 성분이라니 꾸준히 써보게 하려구요~

포장도 깔끔하고
쓰기도 편하게 되어있어요.
아직은 얼마 안되서 효과까지는 모르겠고
꾸준히 써볼께요!",1
28,평점4,21.05.04.,"초등딸아이 이마 좁쌀때문에 오래전부터 봐오다 구입했는데.. 세번정도 사용해서 아직 효과는 잘 모르겠어요.
다만 사용하기 편해서 케어해주는데 부담이 없어서 좋아요.
아이가 이것을 바르면 많이 끈적인다고 좀 불편해는 해요. 그래도 열심히 써서 효과보면 좋겠어요.",1
29,평점5,21.03.10.,벌써 4통째예요. 토너도 써봤지만 전 패드가 더 잘 닦이는거 같아요. 화이트헤드가 많은 저로선 정말 정말 대만족하고 쓰고 있구요. 초5 아이들 좁쌀여드름 나기 시작해서 하루 전날쓰고 담날 됨 좁쌀여드름이 좀 들어가 있고 고1딸도 뺨이 부드러워 졌다고 좋아하네요. 저희집 식구들은 대만족 입니다.,1
30,평점5,20.12.12.,포장도 꼼꼼하고 배송도 빠르고 잘 도착했어요 오자마자 사용해봤는데 패치에 첨부물이 충분히 많이 적셔있었구요 시간이 지나고 나니깐 얼굴에 약간 당김이나 건조한 느낌은 아닌데 코팅된 느낌.. 촉촉한 느낌은 아닌데 건조한건 아니고 당김도 없고 신기한 느낌이네요 ^^; 한장씩 집을 수 있는 집게도 같이 있어 위생적이고 좋아요,1
31,평점5,21.02.16.,다른 제품과 리뷰를 보고 비교 많이 해 봤는데 그래도 이 제품이 리뷰가 괜찮아서 구매해봤어요 초등학생 아들래미 좁쌀 여드름이 나기 시작해서 잘 닦아 주고 있는데 괜찮은 것 같아요 좀 더 사용해 보면 좋은 효과를 볼 것 같아요,1
32,평점5,21.04.16.,"이거 완전 기적이예요.
화장품 후기 잘 안믿는데 이거 쓸때랑 안쓸때 차이가 확연해요. 솔직히... 느낌은 별로이고.
뭔가 끈쩍이는 느낌이라... 근데 확실히 피부가 밝아지고 깨끗해져요. 강추요. 두통사서 아들딸 같이 쓰는데 이제 바닥을 보이네요. 재구매 갑니다.",1
33,평점4,20.11.20.,나이가 들다보니 붉은기와 뭔가 피부결이 살짝살짝 오돌도돌하게 올라와서 이제품이 유명하길래 한번 사봤어요 꾸준히 써봐야알겠지만 일단 패드는 깔끔하게 집게로 되어있어서 깨끗하고 편하게 쓸 거 같아요 팩으로 올려놓으려고요 화장 잔여분도 지워주니 좋을거같아요 토너도 같은 거니 잘 쓰겠습니다,1
34,평점5,21.03.13.,초등학생3학년 딸래미 얼굴에 여드름은 아닌데 마스크로 인한 트러블이 생겨서 진정시켜주고자 주문했어요.피부가 예민한편인데 한번 쓱 닦아줬는데 따갑다거나 발진나지않는거 보니 순한편인가봐요. 촉촉한편이라 만족해요.~지속적으로 써보고 효과있었으면 좋겠어요~,1
35,평점5,21.01.04.,"믿고쓰는 아누아 ღ
대용량 어성초 토너 2통 싹비우고 새로나온 클리어패드를 구매해보면서 “클리어패드+작은용량 77토너” 세트로 갈아탔어요! 다쓴 제품들과 이번에 시켜서 도착한 제품들을 함께 찍어봤습니다! 출근 전 바쁜 아침에 클리어패드 한두장 올려뒀다가 화장하는게 피부도 좋아지고 화장도 잘먹더라구요 ㅎㅎ 저녁에는 스킨 여러번 발라주거나 가끔 닦토해주면서 각질제거 및 피부결 정리합니다! 진짜 화이트좁쌀이나 트러블 많이 없어졌어요 ㅠㅠ
많이파세요 아누아~~",1
36,평점5,21.04.10.,"초4 여아 이제 턱이랑볼쪽에 좁쌀이 나기시작해서 안되갰다싶은 찰나에 요걸 발견했어요.
여러개 살까하다 또 안맞으면 돈 아까울거같아서 일단 실험으로 1개만 샀어요.
온날 바로 아이 씻고 나서 얼굴오 한번 닦아줬는데... 이야 1번으로 많이 줄었더라구요. 약간 아까운건 제가 한번 더 닦구요 ㅎㅎ
일단 요거 한통 다 써보고 효과있으면 쟁여야지요ㅡ ㅎㅎ",1
37,평점5,21.03.06.,한통 사용후 효과 좋아서 두통 더 구매해요 5학년 남아 볼에 좁쌀처럼 만져지고 약하게 빨갛게 보이기 시작해 이틀이나 매일 사용 하는데 확실히 효과 좋네요 이마 머리카락 라인에 약하게 여드름 생겨서 올려놧더니 그 다음날이면 가라 앉어있어요^^,1
38,평점5,21.01.18.,"딸 피부가자꾸 울긋불긋 좁쌀처럼 올라와 반심반의하며 주문했어요
제발 효과가있길바랍니다
택배받자만자 좋았던건 종이박스에 종이테이프 안에는 뽁뽁이대신 종이로 되어있는 완충제?였어요
이렇게 포장이가능하구나 생각이드니 새롭기도 하고 환경을 생각하는 판매자분의 마음이 전해졌습니다
효과좋으면 다른 제품도 구매하려구요
많이파세요~~",1
39,평점4,21.02.16.,"좁쌀여드름으로 고생 많이 했는데요, 이것저것 써보다가 이것도 실험삼아 한번 사용해보려고 구매했는데, 요즘 좁쌀 여드름도 많이 줄어들었고, 얼굴 전반적으로 트러블이 많이 가라앉아서, 매우 만족하면서 쓰고 있습니다~ 일시적인건지 조금 더 두고봐야하겠지만, 2주 정도 사용했는데, 지금처럼만 유지된다고 하면 계속 사용하려구요!!! ㅋㅋㅋ",1
40,평점5,21.05.07.,"효과있어요. 얘들쓰기 자극없고 여드름짤때 소독용 솜으로도 쓰고 확실히 잦아들어요. 여드름이 나이따라 쭉 따라오는 것이기에 완치될순없어요. 그래도 제품 잘 쓰면 70%정도는 없어지니 안쓸수가 없네요,한국화장품 참 많이 발전했어요~~^^",1
41,평점5,21.02.27.,"기존 좋다던 화장품을 오래 쓰고 있었는데
어느순간 트러블과 뾰료지들이 확 올라오더니 그이후 들어갈 생각을 안하더라구요.
그땐 넘 속상했는데.
우연히 여기 제품을 알게 되었고 한번 써보자해서 여러게 구입해서 꼬박꼬박 잘 써주었더니 일주일만 지나도 효과를 보기 시작했습니다.어성초가 예민하고 트러블에 좋다고 들었는데 구입하길 잘한거 같아요
지금 쓰고 있답니다.
바빠서 사진은 못찍었어요
^^",1
42,평점5,20.11.28.,왜 갑자기 이렇게 좁쌀여드름이 볼 쪽을 올라오는지 모른채 성격상 참지 못하고 쥐어뜯기를 수백번 ㅠ 광고보고 구매했어요 한 4번정도 썼는데 갑자기 화르륵 올라오는 좁쌀을 좀 진정시켜주는 효과가 있는거 같아요 촉촉하구요 우선 열심히 매일 써보고 효과를 체험해봐야겠어요~,1
43,평점3,20.12.31.,좁쌀여드름이 많은 아이땜에 구매했어요포장은 깔끔하고 한장씩 사용하기 편하게 되어 있네요집게가 있는데 집게를 놓을곳이 마땅치 않아요 속에 있는 비닐을 완전히 떼지 않고 위에 넣고 닫으려 했더니 닫히지가않아서 안에 세워뒀는데 눕혀져버려 다시 꺼내둬야겠어요사용감은아이는 처음 따갑다고 했고 촉촉함은 전혀 못 느낀다고 하네요제가 해봐도 촉촉하진 않고 찐득하다해야 하나 그래요~며칠 더 사용해봐야 알 것 같아요현재는 한장씩 바로 꺼내 닦을 수 있다라는 장점만 있어요^^;;,0
44,평점5,21.02.01.,"스킨,로션 써보고 좋아서 이것도 믿고 구매했네요
저도 그렇고 초등아들도 마스크때문에 트러블 생겨서 쓰는중인데 눈부신 효과까지는 아니지만 확실히 좁쌀은 많이 가라앉았어요
꾸준히 써봐야 알겠지만 지금까지는 만족스러운 효과를 봤습니다.
한통 다 쓰고나면 또 쓸 생각이구요^^",1
45,평점5,21.04.08.,"최다 거즈 패드라고 나온것들은 얇아서 쓰기되힘들고 보풀겁나게 일어나서 쳐다도안보고있음. 기존에 처음나온 셀리맥스의 지우개패드만 몇년째이용중임.
인터넷 눈팅하다가 우연찮게봤는데 패드도 적당히 두께있고 문지르면 조금은 보풀이 일긴하는데 자극적이지 않음. 집게도 잡기편한모양으로 되어있어서 맘에쏙들어벌임ㅋ",1
46,평점4,21.04.13.,배송 정말 빨랐어요~ 인스타 광고보고 들어오게 되었고 딸이 5학년이고 이마에 좁쌀이 있는 상태라 광고내용하고 딱 맞아 샀는데 딸램은 담날부터 얼굴이 붉어지고 좁쌀이 볼까지 내려와서 중지 시켰어요~ 선크림도 그래서 못바르거든요...아무래도 아직은 피부가 그런가봐요...그래서 제가 세안후 씁니다~ 각질재거가 되는듯하여 잘 쓰고있어요~^^,1
47,평점4,21.02.02.,"통이 크길래 패드도 큰가 했더니 그건 아니네요
트러블케어는 아직 확연하진 않지만 효과는 보여요 다만 많이 건조해지는듯 해서 수분크림 필수 입니다 윗부분이 촉촉하지 않고 패드가 매마른 듯한 느낌이 들어 쓸때 통을 한번 뒤집어 흔들어 쓰고 있어요 토너를 따로 사야할지 고민입니다",1
