,content,ans
78,순해서 자극없고 엄청 촉촉해요~~늘 이것만 써요,1
79,건성피부인데 바르면 금방 촉촉해져 좋아요,1
80,포장이 깔끔해요. 스킨은 촉촉하고 좋아요.,1
81,늘쓰는 거예요 여기가 싸고빨라요,1
82,엄마께서 기존에 계속 사용하시던 한율 스킨을 거의 다써가셔서 하나 더 샀어요! 무난하게 쓰기 좋다고 하시더라구요! 샘플도 많이 넣어주셔서 잘쓰겠습니당,1
83,"촉촉합니다 다 필요없고 진짜 촉촉해서
너무 만족스러워요
24시간 보습력이라고 광고하던데 그 이유가 있었네요
그렇다고 막 얼굴에 무겁게 느껴지는 보습 아니고 속부터 꽉 채우는 보습력이네요
굿굿!!",1
84,"스킨 2개와 로션1개 구입했습니다
촉촉해서 보습력이 좋은 제품인 것 같구요
건성피부이신 분들께 잘맞는 것 같아요
엄마가 좋다고 또 주문해달라셔서
재주문했습니다",1
85,너무조아여 또사야지 에헤헤헤,1
86,"쫀쫀해서 겨울철에 사용하기 좋을꺼같아요!
그리고 패키지가 너무 예쁘네요ㅠㅠ",1
87,콧물 제형이고 아주 쫀쫀해서 좋아요 나중에 본품 두매하려고여!!,1
88,배송도 빠르고 진액 스킨답게 진득하니 더 촉촉한듯합니다. 저는 이런 느낌의 스킨이 더 좋아요.,1
89,진액이라 요즘같은때에 촉촉하니 넘 좋아요,1
90,수분을 쫙 잡아주는 느낌이라 좋아요^^,1
91,엄마가 너무 좋아하세요 ㅎㅎ!!,1
92,늘 쓰던거에요 좋아요 ㅎㅎ,1
93,"은근 보습력이 좋아서 바르다가 안 바른 날에는 허전해서 찾게 되더라고요ㅠㅠ 피부에도 무리 없이 발려서 너무 좋았습니다! 얼마 안 남아서 아껴 쓰는중,,",1
94,저번에 매실스킨사서 잘써서 이번에 다른걸로 주문해밨어요. 역시 샘플도 많이 보내주시고 상품도 만족합니다,1
95,우와~산뜻하고 아침 공기를 느낄수 있는 청량감이 있어요 그런다고 그리 가벼운 스킨은 아니고 에센스. 진액 스킨이네요 ~넘나 좋아요 향기가 넘나 좋아요,1
96,처음 써봤는데 쏘쏘해여 구리고 패키지가 너무 귀여워요 ㅜㅜ,1
97,배송 빠르게 왔어요~ 전에도 쓰던거라서 잘 쓰겠습니다~:D,1
98,아직 사용을 못했습니다! 쑥과 달리 쌀은 스킨이라하기엔 제형이 아주 되직한 느낌이드네요. 맑은 콧물 느낌이 아니라 걸죽한?..ㅎㅎ 묵직한 에센스 같은데요? 잘 맞았으면 좋겠어요 ㅎㅎ 샘플인데도 포장이 센스있고 귀엽네요,1
99,봄에 쓸려고 주문했어요 배송이 많이 느리네요,1
100,쓰던제품이에요 배송 빠르고 좋습니다,1
101,열심히 토너로 잘 사용하고 있어요,1
102,쫀뜩하면서 시원하게 찹찹 발려요,1
103,잘쓰고있어요~ 좋아요,1
104,늘 쓰는 제품이에요^^,1
105,"가격도 좋고, 포장도 꼼꼼하고,,제품은 당연 촉촉하고 좋아요",1
106,물스킨이 아니라 톡톡 치는 만큼 나와서 양 조절이 편해요! 꾸덕한만큼 촉촉합니다. 건조한 계절에 쓰기 좋을 것 같아요. 향은 은은해서 거부감 없어요.,1
107,사용하던게 똑 떨어져서 급히 샀는데 배송 정말 빠르네요! 잘 쓰고 있어요,1
108,피부가 아주건조한편인데 지속적으로 사용하다보니 부드럽고 촉촉함을 느껴 재구매하면서 하나는 친구에게 선물할려구 2개 구매했습니다.,1
109,엄마가 사용하시는 제품이예요 쿠폰할인으로 좋은가격에 구매했습니다,1
110,"남푠이 이것만 써요
순하고 좋아요",1
111,이거 진짜 좋네요 기름지지도 않고 촉촉하고 아주 마은에들어요 기존 진액스킨보다 빨간쌀 버전이 더 마음에들어서 이걸로 계속 구매할굿같아요 한율 제품력 정말 좊아서 신제품들은 항상 기대됩니다,1
112,"사용하던 제품 제쳐주고 쓸만큼 너무 좋아요
관자놀이 쪽으로 트러블이 올라와서 스트레슨데 이거 바르면 들어가는데 다음날 바로 보여요!",1
113,"일주일만에 도착했어요!

세일품목인데 샘플도 많이 주시고 또 유통기한도 2023년까지 넉넉해서 만족입니다 :)

한달사용하고 후기 남길께요^^",1
114,전에도 쓰다가 떨어져서 또 샀어요. 세안 후 바로 바르면서 온종일 촉촉해요,1
115,"피부자극은 없고, 발림성이 좋아요.
스킨인데 진하고 조금 끈적한 느낌이라
이 계절에 딱 좋은거같아요.",1
116,촉촉하고 좋습니다. 써보고 좋아서 한율 화장품 추가로 구매했아요,1
117,"촉촉하구 좋습니다
겨울철에도 쓰기에 안 건조하고 좋아요!",1
118,늘 쓰던건데 배송도 정말 빨리주셨어요 좋아요,1
119,어머님께서 항상 쓰시는 제품이세요. 아무 화장품이 못 바르시는데 이 제품은 피부에 잘 맞으셔서 항상 주문해드려요. 싼 가격에 잘 샀네요.,1
120,할머니 선물로 드렸는데 좋아하시네요~,1
121,건성피부에 촉촉하니 좋은 것 같아요.,1
122,피부가 촉촉해지고 부드러워 졌어요,1
123,항상쓰던건데 배송완전굿~!!,1
124,양이 꽤 되어서 한달넘게 썼어요 샘플이었는데도요 스킨팩으로 사용하지않는이상 한통사면 엄청 오래쓸 것같아요 촉촉하고 좋아요 향기도 좋고 빨간쌀 진액스킨 재구매 할 거예요 평점 만점!ㅎㅎ,1
125,엄마집으로 보냇어요~~,1
126,한율제품 넘좋아요.,1
127,"너무
잘쓰고있어요~",1
128,촉촉한 편이구요 달달한 향이나요. 독하거나 나쁘지는 않은데 무향 선호하시는분들은 매장에서 향 맡아보고 사세요. 무난하게 쓰기좋은 스킨인듯?,1
129,"정말 진액ㅋㅋㅋ 엄청 찐득한 제형이예요
크림스킨이랑 이거랑 번갈아가면서 쓰는데 이게 좀 더 쫀쫀한? 콧물제형이예요",1
130,빠른배송으로 잘 받았습니다! 기한도 넉넉합니다,1
131,늘 쓰는 제품이에요. 촉촉하고 끈적끈적. 스킨도 끈적끈적~ 건조한 피부에 아주 좋아요. 건조한 제 피부에는 딱 좋아요. 가격이 저렴해서 구입했은데 유통기한도 넉넉하네요.,1
132,"빠른 배송과 저렴한 가격.

유통공룡 롯데가 외형이 아니라 내실을 다지고 있는것 같아 다행입니다",1
133,"한율은 늘 믿고 매번 쓰는 화장품이예요.
중성에도 잘 맞아서 좋아요",1
134,"우연히 샘플받아 썼는데 피부에 잘맞아서 본품 샀어요~

좋아요",1
135,두병째에요. 세안후 바로 바르면서 촉촉함이 오래가요,1
136,체험으로 써봤는데 본품도 살거같아요 만족해요,1
137,샘플로 받아서 썼다가 본품살라구오 짱좋아여,1
138,"배송이 빠르고 좋아요
계속 한율만 사용중",1
139,항상 좋아해서 같은것만 쓰고있어요,1
140,늘 쓰던걸 저렴한 가격에 잘 샀네요,1
141,굳굳굳 아주좋아요 최고,1
142,촉촉하고 순해서 사용하기 좋아요.,1
143,아직은 좋은거 같아요 촉촉해요,1
144,촉촉해서 너무 좋아요,1
145,빠른 배송에 너무 만족스럽습니다 딱히 파손된 곳도 없고 잘 왔습니다 쓰던거라 잘 샀어요~!,1
146,촉촉하고 보습되는 느낌이 좋았어요! 그리고 바를 때 향도 괜찮았구요ㅎㅎ 들고 다니며 아주 유용하게 잘 썼습니다.,1
147,요즘처럼 건조한 날씨에는 좋은거 같아요 끈적한 제형이라 바르면 촉촉하고 좋으네요 사용중인 스킨다 사용하면 구매할생각입니다,1
148,"요즘쓰기 딱이에요 촉촉하고 촉촉함이
오래가서 쓰기 좋아요",1
149,아침에 3스킨 해주면 겨울에도 화장 챱챱 잘먹어서 너무 좋았어요. 다 사용하면 본품구매하려구요!,1
150,잘사용하고 있어요. 사은품도 아주 좋아요. 촉촉하고 순한느낌이 너무 좋아요,1
151,"촉촉해서 매일 이 제품만 쓰는데 시중에서는 가격이 좀 부담스러운데 여기서 스킨과 크림 같이 사도 부담스럽지 않은 가격이여서 진짜 추천해요!
배송도 엄청 빠르고 만족스러워요",1
152,"너무너무 좋아요 샘플도 챙겨주시고 잘쓰고 있어요 역시 한율 흡수력도 좋고 너무너무 만족하면서 쓰고 있습니다 다음애도 이 쿠폰이 계속 생겼으면 좋겠스빈다!!
다음에도 여기서 시킬게용",1
153,"꾸떡꾸덕한 느낌으로 좋은 향이나요.
꾸준히 써봤디만 드라마틱한 효과는 모르겠어요.",1
154,쫀쫀해 흘러내림이 적어 보습에는 탁월합니다 건조한 피부에 적극추천합니다 빨간쌀 라인을 써써 피부가 건조하지않고 매끄러워져 저절로 손이갑니다 로션 크림까지 모두쓰고있어 적그추천합니다,1
155,"정말 좋습니다
오랜시간 촉촉함이 오래갑니다
처음으로 이렇게 만족스러운 화장품을 만났네요
추천합니다꾹꾹",1
156,늘 쓰던 제품~건성인 제 피부에 딱 맞아서 쭉 쓰고 있습니다,1
157,한 번 구입했다가 좋아서 계속 쓰고 있네요 :),1
158,크기만 아쉽지 촉촉하니 좋아요 겨울에 최고,1
159,양도 많고 촉촉하고 겨울에 쓰기 딱입니다,1
160,아주 잘썼어요 예민한데 피부에 잘맞아요,1
161,"한율처음써보는데 되게좋네요
만족합니다",1
162,피부결이 많이 좋아졌어요. 맘에 듭니다.,1
163,촉촉하고 좋아요 겨울에 쓰기 딱입니다,1
164,또구매 할께요. 빠른 배성 좋아요,1
165,엄마 어버이날 선물용. 촉촉해용,1
166,체험용인데 용량도 많고 좋아요,1
167,늘 사용하는 제품 맘에 들어요.,1
168,좋아요 잘쓰고 있습니다,1
169,"한율빨간쌀 진액스킨 에멀젼 크림 구매했어요
늘 사용하던거라. 만족합니다 감사합니다",1
170,코로나로 계속 기초화장으로 사용하고 있는데 가격 대비 품질 만족합니다. 달랑 이것 하나만 주문했는데 샘플을 많이 챙겨주어 기분이 좋아요,1
171,"엄마가 항상 쓰는 화장품이라 떨어지기전에 주문했습니다!
배송이 빨리 보내주셔서 감사합니다^^",1
172,선물했어요 맘에들어하네요ㅎㅎㅎ,1
173,"엄마가 꾸준히 사용하시는 제품이라서
주문했습니당
배송도 빠르고 좋아요
다음번에 또 구매할게요 :-)",1
174,쓰던제품인데 배송빠르네요,1
175,빠른 배송 감사합니다.,1
176,진액 스킨이라 꾸덕질불 알았는데 생각보다 알콜 느낌이 많이나요,1
177,피부가 매끈해지는 거 같아서 만족해요. 스킨향도 마음에 들어요.,1
178,매번쓰지만 저렴하고 아이크림까지~~ 행사해서 잘 구입했어요,1
179,계속 재구매하여 사용중이고 피부에 저자극이며 좋습니다,1
180,촉촉하고 향이 나쁘지 않요 트레블 케어는 잘 모르겠어요,1
181,촉촉하고 좋습니다. 엄마가 쓰시길래 써봤는데 좋아요,1
182,샀을때 찍어둔 사진이네요.. 피부결 좋아졌어용,1
183,집에서 구매할수있어좋았고 매우촉촉합니다,1
184,저렴하게 구매 하엿네요 부드럽고 좋아요,1
185,어머니가 쓰시는거라 재주문해드렸어요,1
186,좋아요 오프라인보다 저렴하게 샀어요,1
187,좋아요 체험 이벤트 자주 열어주세요,1
188,좋아요 쓰던거 다쓰면 사볼까합니다,1
189,좋아요 어머니가 항상 쓰시는거에요,1
190,엄마가 항상 쓰시는 제품이에요~,1
191,아주 만족스럽게 잘 쓰고있어요!,1
192,저렴하게 체험해서 좋았습니다!,1
193,진액스킨이름답게 좋아요,1
194,너무 좋아요 촉촉 보습!,1
195,제품 잘 쓰고 있습니다.,1
196,잘 사용하고있습니다!,1
197,선물하기 좋아요 ㅎㅎ,1
198,촉촉하고 잘발려요~^^,1
199,한율 늘 써요 좋아요,1
200,촉촉해요 ! 잘쓸게요,1
201,잘받았습니다. 한율 회사는 같은데 전에쓰던게 안나와서 써봅니다.,1
202,제형도 쫀득쫀득하고 용량도 많고 다 좋아요,1
203,3스킨할때나 콧물스킨필요할때 유용했어요 저렴하게 잘이용했습니다^^,1
204,상품도 만족하고 배송도 만족합니다.,1
205,패키지가 귀여워요~건성 피부인데 점도 있는 제형이라 피부에 촉촉하게 흡수되어 보습효과가 좋아서 만족해요em>~~,1
206,쓰고있는거 다 쓰면 쓸려고 냅뒀늠데 좋다고들 많이해서 조만간 쓸예정이에용,1
207,이번에 처음 써보는데 대만족 해요! 가격도 좋고 쭉 사용해 볼거 같아요 촉촉하고 진정도 잘되고 이런 체험딜 나무 좋아요 어느정도 사용해 보고 구매항수 있어서,1
208,가볍게 토너로쓰기좋고 생각보단 끈적거리며촉촉한타입입니다,1
209,건조하고 묽어요. 금방 흡수됩니다. 향이 진하지않아 좋아요,1
210,"세일을 많이해 저렴하게 샀어요
보습력이 좋아 요것만써요",1
211,피부 트러블이 없고 보습에 좋아서 촉촉함이 오래가요,1
212,세수하고 쌀진액스킨 한가지만 바르는데 촉촉해요,1
213,"꾸준히 사용하는 제품입니다. 보습력도 좋고 향도 거의 없어서 좋습니다.
아들이 물광피부냐고 물어보네요 :)
앞으로도 사용할 예정입니다.",1
214,발림성도 좋고 촉촉해요. 본품 구매 예정입니다.,1
215,너무 건조해져서 샀었는데 도움 많이 받았어요. 트러블이 나지도 않고 수분팩으로도 활용했더니 건조한거 많이 좋아졌어요,1
216,순하고 촉촉해서 좋아요 본품도 써보고싶네요,1
217,자주 쓰는 제품이네요 촉촉하고 윤기나요,1
218,"이 제품을 찾는데 다른곳 보다 저렴했어요
스킨을 로션보다 더 많이 ㅆ는 편입니다",1
219,"촉촉하고 순해요
피부 보습이 잘됩니다",1
220,"가성비 좋아요.
저렴하게 구입 했어요",1
221,조금 사용했는데도 촉촉하고 좋네요,1
222,촉촉하게 흡수되고 향도 좋아요,1
223,너무 좋아여 재구매하고싶네요,1
224,촉촉합니다 싸게잘구매햇어요,1
225,요즘같은때에 바르면 좋아요,1
226,잘 사용했어요 감사합니다^^,1
227,늘쓰던거고 배송도빠르구요,1
228,항상 쓰는 제품 아주 좋아요,1
229,좋 아 요 매번 주문해요,1
230,몇년째쓰는제품입니다,1
231,촉촉하고 좋아요 ㅎㅎ,1
232,"어머니가 좋아하시는 브랜드고, 자주 쓰시던거라서 쓰면서 자극적이지 않다고 좋아하세요. 계속 쓰시는거 보면 좋으니까 쓰시겠지요?",1
233,잘 쓰고 있습니다..,1
234,가격이 싸다고 생각하고 주문했는데 받고보니 150ml였네요. 타사이트에서 200ml 이거보다 더 싸게 샀더라고요. 티할인해서 샀는데도 더 비쌉니다ㅠ 샘플조차도 하나 없네요ㅠㅠ 제품은 마음에 들어요. 촉촉합니다.,1
235,"엄마가 쓰시는건데요
요 쌀라인만 항상 사용하세요 ㅎㅎ
제품 구매할때 마다 두개씩 사서 사용합니다
정말 믿고 쓰는 제품이래요
피부에 잘 맞게 쓰신다고 하니 저도 안심하고 사드립니다~^^",1
236,"저도, 어머니도 쓰는 제품입니다
말해뭐해 걍 좋아요
여긴 배송도 빠르네요 ^^",1
237,"사계절 무난하게 잘 사용하고 있어요.
찐덕임 없이 빠르게 흡수되어 여름엔 좋은데
겨울엔 스킨로션만으론 부족한감이 있어요
다른 제품과 함께 쓰면 좋아요~~",1
238,묽은점성이아니어서겨울에보습력이좋아요! 겨울철스킨으로딱좋아요,1
239,엄마 사드렸는데 촉촉하고 좋으시데요~~ 샘플도 많이 주시고 귀여운 도시락도 왔네요 ㅎㅎㅎ 엄마는 몇년때 꾸준히 이거만 쓰세요 ㅋ!!,1
240,"진짜 촉촉하고 보습력이 오래가는 느낌
주변에 계속 추천중이에요ㅎㅎ
정말 좋습니다",1
241,"좋아요
피부 부들부들 흔구같으요",1
242,역시 한율 제품은 순하고 효과가 좋아요~ 체험용으로 사용 할 수 있어서 좋았어요^^,1
243,"콧물스킨인데 흡수도 빠르고 촉촉하니 좋아요
다음에 큰거 사야겠어요ㅎㅎ",1
244,빠른 배송 감사합니다,1
245,아직 사용전이지만 좋을거 같아요 합리적인 가격에 써볼수잇어서 굿,1
246,"늘 구매해서 사용중입니다
쌤플.더 주셔도 되는데 ㅋㅋ 딱 사진에.나와있는거 만큼.주셨오요 ㅎㅎ
잘쓸게요 빠른배송 감사합니다",1
247,요새 마스크 쓰구 다녀서 아무리 보습을 잘해줘도 금새 건조해지는데 빨간쌀 진액스킨은 촉촉함이 굉장히 오래가는거 같아요~ 마스크 속에 제 피부가 당기는것두 적어지구요~ 너무 맘에 들어요~ 재구매 예약이용~^^~,1
248,촉촉해서 로션 안발라도 될 정도예요 괜찮네용,1
249,리뉴얼전에 잘 썼던건데 후에도 좋네요 만족,1
250,촉촉하고 산뜻한 마무리감으로 쓰기 좋아요.,1
251,엄마 사드렸는데 촉촉하고 좋다고 하시네요 한율 제품 처음이었는데 다른 제품들도 구입해봐야겠어요,1
252,작은 사이즈인줄 알았으면 안샀을텐데요,1
253,엄마가 좋다고 하셔서 본품주문하려구요,1
254,저렴하게 사서 잘 썼습니당 감사합니다~=,1
255,체험단용이라 일단 열심히 써보는중..,1
256,기타 인터넷 쇼핑몰 대비 가격이 비싸네요. 전체적으로 비싸다고 판단됩니다.,1
257,아직 써보진않았지만 기대되요,1
258,촉촉해서 너무 잘 쓰고 있어요,1
259,너무 저렴하게 잘 구매했어요,1
260,향도 좋고 촉촉하니 좋아요,1
261,순하고 촉촉해서 좋아요.,1
262,첫구매입니다.만족해요,1
263,좋아요^^ 어머니 선물 해드렸는데 좋아하세요. 쓰던건데 싸게 잘 샀어요,1
264,첫사용 느낌은 좋아요,1
265,아주 좋습니다 순해요,1
266,"가벼워서 좋고 향도 좋고 촉촉해서 좋아요
한율 상품은 실패가 없네요",1
267,쑥이랑 빨간쌀 모두 구매했는데 같은용량인데 빨간쌀이 더 작아보이고 화장솜에 적셔서 팩처럼 했는데 진정효과 좋아요,1
268,기존에 작은병 샘플로 써보고 좋은것같아서 이번에 체험분 신청했습니다. 꾸덕한 콧물스킨 느낌이고 건성인 제가 지금계절에 쓰기에 촉촉하니 좋아요.,1
269,제형이 신기했어요. 점도 있는 제형인데 끈적이지 않아요. 두 번 정도 발라주니 굳이 에센스 써주지 않아도 수분감도 만족스러워요. 다쓰고 본품도 구매해보려구요,1
270,별 기대 안했는데 되게 좋아요!!! 순하고 속보습되느 ㄴ느낌인데 끈적거리진않네요 본품구매 생각있어요,1
271,"손에 먼저 테스트 해봤는데요.
촉촉하고 향도 좋아요. 샘플 다 써보고
본품 구매하러 올게요~!",1
272,"흐르지않아 맘에 들고 수분가득 너무 좋아요^^
꼭 본품구매해야겠네요~
배송 굿!!",1
273,"좋은 상품을 좋은 가격을 구매해서 좋아요
배송도 빨랐어요 감사합니다",1
274,너무 좋으네요 ㄷㄹㄷㄴ,1
275,에센스같은 스킨이라 촉촉해요. 겨울에 사용하면 너무 좋을거같아요,1
276,민감성 피부인데 자극없이 촉촉하고 좋네요 다 쓰고나면 본품 구매할려구요 근데 50ml 정말 작네요,1
277,수부지인데 촉촉하니 좋은듯합니다 포장이 너무 귀엽게 왓어요,1
278,물스킨 아니라서 좋네요 촉촉한 스킨이라 피부에 잘 스며들고 보호되는 느낌이에요 그리고 패키지가 너무 귀엽네요,1
279,예민하고 자극적인걸 싫어하는 피부인데 아주 만족스러워요,1
280,요즘같은 날씨에 촉촉하고 좋아요 패키지도 귀여워요ㅎㅎ,1
281,점성이 있는 편이라서 흡수 시켜서 쓰고 있어요 촉촉해여,1
282,꼭 사용해보고싶었는데 기회가 좋아서 주문하게되었습니다~ 향도 좋고 촉촉해서 좋아요!,1
283,향이 좋고 피부에 열감이 있는데 제법 잠잠해졌어요,1
284,에센스 겸용으로 사용할 수있는 토너라서 좋았어요.,1
285,상품만족하고 배송빠르고 안전하게 잘 받았습니다,1
286,써보고 싶었는데 저렴하게 사서 좋아요 촉촉해요,1
287,겨울에 사용허기 딱 좋은 쫀득 재형의스킨에요,1
288,촉촉하고 부드러워요 자극도 없고 체험단 이벤트로 구매했는데 재구매의사있어요,1
289,예쁜 포장에 와서 좋았어요 촉촉하고 좋네요,1
290,6년정도 사용하고 있는데 항상 만족스러워요,1
291,좋아요!!!늘 초록색만썬ㅆ는데붉은색도최고,1
292,내피부에 잘맞는 것 같아요 향도 좋습니다,1
293,포장도 너무 예쁘고 싸게 잘 사서 좋아요!!,1
294,선물드렸는데 아주 마음에 들어하시네요,1
295,쿠폰과적립금으로저렴하게잘구입했어요,1
296,촉촉하고 좋아요 두 종류 다 주문했어요,1
297,한번 써보고싶었는데 너무 맘에들어오,1
298,가격대비 상품이 가성비가 좋아요,1
299,겨울에 쓰기 좋아요 만족합니다,1
300,사계절 무난히 사용하고있어요,1
301,좋아요 크키도 생각보다 커요,1
302,촉촉하고 흡수도 좋네요 ㅋ,1
303,패키지도 이쁘고 촉촉해요~,1
304,저렴하게구매해서 좋아요~,1
305,가격대비 아주 좋습니다...,1
306,촉촉하고순한거닽아요,1
307,아주 촉촉하니 좋네요,1
308,향도 좋고 순하네요!,1
309,제품 잘 받았습니다.,1
310,피부도 예민해서 아무거나 바르면 트러블 나는데 이 스킨은 순해서 트러블 날일도 없어요!! 수분도도 높아서 스킨 만 발라도 피부가 촉촉해요!!,1
311,"제가 건성인데 겨울철되니까 일반 토너는 건조하더라고요. 그래서 좀 진득한 텍스쳐를 원했어요!!
건조한게 좀 덜하네요 ㅎㅎ 더써보고 다시 리뷰해야할거앝습니다 일단 좋음",1
312,잘받았읍니다,1
313,포장박스랑 내부 종이포장지 다 뜯긴 상태로 오네요ㅋ,1
314,"샘플 굿굿 확실히 겨울에는 넘좋네요. 에멀젼빼고 스킨, 크림 두개만써도 충분해요 여름에는 다른 라인써야겠어요. 여름엔 많이 찐득함이 겉돌거같고요. 지금 딱좋아요",1
315,민감성 트러브루피부라 가을 겨울만 되면 피부가 많이 건조하고 예민해져요. 트러블 때문에 아무 화장품이나 바르지 못하는데 일단 바른뒤 트러블이 없었어요. 그리고 건조한 피부에도 촉촉함이 느껴져서 좋아요.,1
316,요새 피부가 너무 건조했는데 촉촉하고 너무 좋아여,1
317,너무좋아요 짱이에요 좋아요,1
318,촉촉해서 급할땐 이것만 손으로 톡톡 흡수시켜요! 살짝 끈적이기는 한데 그만큼 보습이 잘 안날라가요,1
319,"샘플임에도 포장도 이렇게 이쁘게 해주시고 ㅠㅠ
요즘 환절기라서 너무 건조했는데 촉촉해서 좋아요",1
320,"체험단 제품 치고 포장 상태 완전 고급지네요
한번도 안써봤는게 한율 믿고 쓰는 브랜드라 기대되요",1
321,찬 바람 불고 속건조가 심해서 이것저것 써봤는데 빨간쌀 진액 스킨 좋아요! 여러번 레이어드 해서 발라주면 촉촉합니다~,1
322,항상 스킨케어 한율로쓰는데 쌀 라인이 여름겨울 적당히 촉촉하게흡수되서 좋더라규요,1
323,촉촉한 거 좋아하는 어머니께서 쓰시는 제품이에요. 벌써 몇 통째인지도 모르겠네요:),1
324,얼굴에 금방 스며드는 느낌입니다 타제품보다는 스킨을 조금 많이 쓰게 되는거같아요,1
325,체험상품인데 용량이 아주 넉넉해서 한참 쓰겠어요~ 써보고 좋으면 구매하겠습니다!,1
326,평소에 써보고 싶었는데 체험단으로 사용기회가 와서 좋아요. 제형도 만족스러워요,1
327,테스트 해봤는데 촉촉하고 좋은 것 같습니다 ㅎㅎ 포장듀 꼼꼼하게 되어서 왔어요,1
328,"사진찍고 바로 발라봤는데 발림성 향 어느하나 놓칠 것 없이 편안하네요, 이 걸로 정착하면 되겠네요잘쓸게요!",1
329,아니~ 체험 상품 주문하면서 포장이 이렇게 이쁠 일인가요?배송도 빠르고 좋아요,1
330,스킨이지만 진한 농도로 에센스 없이도 쫀쫀하고 촉촉해서 마음에 들어요,1
331,바르고난후엔 괜찮은거 같아요 다른주분은 몇일더 발라봐야 알것같네요,1
332,평소에 써보고싶었는데 체험하게되서 좋아요. 트러블없어요 아직까지,1
333,"좋아요 관심있었는데 체험판을 접하게 됬네요!
포장이 너무 귀여워요..",1
334,"이렇게나.포장 귀엽기 있나요?
한율 좋은거야 뭐. .써보고 싶었던거라",1
335,민감성 피부인데 크라블 없이 촉촉하고 향도 좋고 마음에 들어요!,1
336,늘 사용하는 제품이라 저렴한곳을 찾았는데 저렴하고 배송도 빨라 기분좋은 쇼핑이었습니다. ^^,1
337,"배송 엄청 빠르고 싸게 잘샀어요
써보고싶었는데 정말 좋네요^^",1
338,촉촉하긴 한데 잘 모르겠어요 그냥 다른 제품이랑 비슷해요,1
339,매번 쓰던 제품이라 재구매건조한 피부에 촉촉해서 좋아요,1
340,사용전이라 아직 모르겠지만 피부에 맞으면 좋겠네요.,1
341,잘 쓰던 제품 저렴하게 구매할 수 있어서 좋았어요^^,1
342,스킨은 한율 빨간쌀진액만 쓰는데 앰플같고 좋아요!,1
343,원래 발효가 잘맞아서 잘 쓰고있습니다. 촉촉해요,1
344,"잘 받았습니다.
어머니가 이제품만 사용하시네요.",1
345,진득한 제형인데 안끈적이고 괜찮아요 촉촉해요,1
