,content,ans
731,촉촉하고 어느정도 보습효과도 있어 여름에 사용하기 좋아요. 만족하며 사용하고 있어요. 재구매의사 있습니다.,1
732,피부자극은 확실히 없는거같아요.발림성좋고 촉촉해서 데일리 사용으론 적합한거같아요.,1
733,"빠른 배송입니다 지금 피부가 다 뒤집어 져서
구매했습니다 사용하고 한달 후기 남기겠습니다",1
734,"가성비 너무 좋아서 사용하고 있어요 ㅎㅎ
자극도 안되고 너무 좋아요 ㅎㅎ",1
735,잘사용하고있어요 성분좋아서 맘에들어요,1
736,너무추운날에 배송했더니 스킨이 다 얼었어요 ㅋㅋ,1
737,자극적이지 않고 정말 순합니다 복합성피부인데 여름에 기름잡아주는건 좀 부족하네요ㅜ,1
738,지난번 처음 구매후 만족해서 재구매했습니다 얼굴 보습력도 좋고 산뜻한 느낌이 들고 피부자극도 거의 없습니다 가격대비 토너양도 많아서 오래 사용할 수 있습니다 이번에도 다 사용하면 재구매할 예정입니다,1
739,제가 항상 사용하는 제품입니다.. 1+1행사로 저렴하게 구매를 하였네요.,1
740,일단 가성비가 굉장히 좋고 토너 자체가 가벼워서 좋아요,1
741,"부드럽고 순해서 좋아요.
배송도 빨라요.
만족합니다.",1
742,제품상태나 향도 좋고 제 피부에 잘 맞아서 좋아요,1
743,음 바르면 요드름이 나긴하지만 촉촉해서 좋아요,1
744,"깨끗게 닦이고요 깔끔한느낌?
양도많고 좋아요~^^",1
745,처음 써봤는데 괜찮아요. 가격도 만족합니다.,1
746,순한 닦토 찾아보다가 후기가 좋아서 샀어요,1
747,엄마가 항상 사용하시는 제품입니다 ㅎㅎ,1
748,배송이 빠르고 후기가 좋아서 사봤어용!,1
749,처음 써보는데 피부에 잘맞음 좋겠네영~,1
750,깔끔한느낌이이에요 빠른배송감사해요,1
751,항상 씁니다 매일 쓰기 순해서 좋아요,1
752,시원하고 좋아요 여름에쓰기 좋은듯,1
753,아직사용전이지만 좋을거같습니다!,1
754,저번에 써보고 좋아서 또 구매해요,1
755,흡수도 잘되고 닦토용도 좋아요,1
756,이니스프리 청보리 너무좋아용,1
757,새로운거 써보려고 바꿔봤어요,1
758,피부자극없이 너무 좋네요 ~~,1
759,시원하고 가격 대비 갠찮음,1
760,잘먹을게요. 감사합니다.,1
761,그냥 순한 제품 잘썼어요,1
762,씻고 닦토할때좋아요,1
763,배송빠르구 저렴해요,1
764,배송이 좀 늦네요....,1
765,각질토너?암튼 그거라해서 구매했는데 잘모르겠어요 ㅋ 건조해요 금방 날라가서 스킨을 빨리발라줘야합니다. 저는 극건성이라 더 심한거같아여,1
766,"이니스프리 순하고 성분이 좋아서 믿고 쓰고 있어요.
이번 제품도 좋네요. 앞으로 토너는 이것만 쓸 것 같아요. ^^
감사합니다.",1
767,아직 더 사용해봐야겠지만 잘 사용하고 있어요,1
768,"처음 써봤습니다
닦는토너용으로 주문했습니다
산뜻하고 피부가 정리되는 느낌입니다
자극도없고 끈적임없고 적당히 촉촉합니다
흡수도잘되고 각질도 닦아주는 느낌너무 상쾌합니다
재 주문할 의향있어요",1
769,"처음 써봤습니다
닦는토너용으로 주문했습니다
산뜻하고 피부가 정리되는 느낌입니다
자극도없고 끈적임없고 적당히 촉촉합니다
흡수도잘되고 각질도 닦아주는 느낌너무 상쾌합니다
재 주문할 의향있어요",1
770,"세안후 솜에 적셔 얼굴한번 닦주는데.
이 토너 완전 괜찮은듯 , 사용감깔끔 끈적임없음",1
771,닦토하려고 샀어요. 이거 바르고 나면 얼굴이 상쾌해지는 느낌이에요~~ 잘 사용할게요,1
772,그냥 평범한 거 같아요 피부가 자극되지도 않고 트러블케어가 되는지 잘 모르겠어요,1
773,촉촉하고 좋아요 배송도 빠르네요,1
774,산뜻하고 촉촉임없어서 좋아요 아하바하 안쓰고 그냥닦토할떈 이제품 쓴답니다,1
775,"닦토로 사용하려고 구매했어욤
아직까진괜찮은것같습니다당
꾸준히써보려구욤",1
776,얼굴 자극이나 트러블케어가 되는지는 모르겠지만 촉촉하니 잘 쓰고 있어요,1
777,필링토너는 상쾌한 마무리감일 줄 알았는데 사용할수록 끈덕임이 느껴짐.,1
778,닥토로 쓰는중. 진짜 산뜻한 느낌이지만 쓰고나서 약간의 당김이 잇음,1
779,기름진 거 싫어하는데 이거는 기름지지 않고 건조하지도 않아서 좋아요. 시원함도 있어서 여름 고정 토너로 쓰고 있어요.,1
780,무난하게 쓰기 좋아요. 피부에 자극도 없고 트러블도 잘 안나요.,1
781,피부가 좋지않아서 토너에 민감했는데 이거 산거 잘한것같애요,1
782,아직 오래쓰지않아서 효과가 있는지는 모르겠지만 산뜻합니다,1
783,무난무난템!! 트러블도 없는!!,1
784,배송 빠르고 평소에 필요했던 제품이라 구매했습니다.,1
785,아직 며칠안써서 잘모르겠지만 일단은 만족합니다,1
786,유튜브보고 구매했는데 좋아요 배송도 빠르고요,1
787,아직 사용전이에요 ! 배송 빨랐어용 !,1
788,끈적임없어서 닦토로 쓰기 좋습니다. 그러나 닦토치고 가격 좀 이해 안가는 부분,1
789,순하고 깔끔해서 닦토로 딱이네요,1
790,닥토로 갠츈 무난하게 쓰기좋음!,1
791,잘쓰고잇어요 굿굿굿,1
792,순하고 좋아요. 잘 쓰고 있어요.,1
793,가볍게 쓸 수 있어서 좋아요,1
794,배송 빠르고 맘에 들어요,1
795,자극많지 않아서 좋아염,1
796,역시 이니스프리임니다,1
797,배송이 빠르고 좋아용,1
798,너무 촉촉하고 순해요,1
799,좋아용 ㅎ,1
800,"각질에 효과가있는듯합니다
한번쓰고 계속 쓰고있어요~",1
801,"오늘 배송와서 처음 써봤어요 일단 오늘 처음 사용해서 좋은지는 모르겠지만 스킨팩하기 좋아요
리뷰가 좋으니 계속 써보려구요ㅎㅎ",1
802,유명하길래 함 사봤어요 후기도 좋고 그래서 써보니까 딱 자극없고 촉촉하고 좋음 역시 이니스프리^^~ 다음에도 이거 쓸겁니당,1
803,감사합니다감사합니다,1
804,빠른배송에 꼼꼼한포장 감사합니다,1
805,감사합니다. 잘 사용하겠습니다.,1
806,"요제품은. 여름에쓰면좋을듯해요
겨울엔 좀건조하게느껴지는듯해요
그래도 믿고쓰는 이니스프리라서
다른제품으로 커버중입니다~^^",1
807,"각질케어 잘 됩니다.
이거 쓰다 다른 거로 넘어갔는데 트러블 일어나고 난리나서 다시 이거로 넘어오니 이틀만에 가라앉고 피부결 보들보들~
각질케어 잘 되니 좁쌀도 눈에 띄게 줄었어요.
닦토로 좋습니다.",1
808,가격대비 쓸만해여 무난무난,1
809,"사용하면 너무 시원하구 좋아용
향은 전혀없는데 솜에 묻혀서 닦아내고나면 얼굴이 시원해용^^",1
810,자극 없이 순해서 민감한 피부인데도 잘 쓰고 있어용ㅠ!!,1
811,한번 써서 아직은 잘 모르겠지만 괜찮은 거 같아요.,1
812,아직은 사용전이지만 빠르게 배송와서 좋았습니다.,1
813,무향에 피부에 자극도 없네요 잘 쓰겠습니다~~,1
814,너무좋아요 못구하는줄알고 ㅠㅠ 번창하세요,1
815,수분부족 지성피부인데 촉촉함보다는 건조한 느낌이에요. 제피부엔 안맞나봐요,1
816,늘 쓰던 제품 다시 구매했어요 많이 파세요,1
817,정말 잘 쓰고 있어요! 여러통 쟁여두게요,1
818,그냥 발라도 아무느낌없어요.. 물같아요,1
819,가격대비 양도 많고 가볍게 쓰기 좋어용,1
820,기존에 쓰던 제품이라 재구매했습니다,1
821,"이것만 5통 째예요
트러블 피부에 예민하고 지성피부인데
자극없이 산뜻해요",1
822,배송이 엄청빠르고 1+1이라서 개이득!,1
823,처음사용해보는데 좋았으면좋겠어용,1
824,배송도 빠르고 좋네요 잘쓰겠습니다,1
825,각질관리도 되고 자극적이지 않아요,1
826,매우 순해요 깔끔해요 건성이라 더 촉촉팼음 좋겠는데 그냥 딱 닥토하기 좋아요,1
827,아직 안썻지만 후기보고 사봤어용,1
828,사용후 피부자극이 없어서 좋아요,0
829,닦는 용도로 사용하는데 좋아요,1
830,늘쓰는 상품이라 만족도 좋아요,1
831,배송 빠름 양도 많고 괜찮아요,1
832,꾸준히 한번 써보도록 할께요!,1
833,순하고 좋아요 또 구매할게요,1
834,항상 이거써요 짱조어요 귯굿,1
835,배송빠르고 저렴해서 좋아요,1
836,원플러스 원 이라서 샀어요.,1
837,그냥 딱 그 가격 값 합니다.,1
838,저렴한맛에 쓰기좋습니다,1
839,무난해요 싸게 샀습니다.,1
840,잘받았아서 쓰고 있어요,1
841,닦토중에 최고 촉촉해요,1
842,"배송빠르고 좋아요ㅋ,",1
843,촉촉하고 순하네요ㅎ,1
844,잘 구매했습니다.^^,1
845,감사합니다,1
846,가격대비 무난하고 자극없이 순하게 사용하고있어용,1
847,지난번 사용이후 만족스러워 재구매했습니다 가격대비 양도 많고 얼굴 발림도 좋고 촉촉한 것 같습니다 앞으로 재구매의사 있습니다,1
848,순하고 맑은제형인데 속이 촉촉하게 차는것 같아 넘 좋아요. 딸 사요하라고 사줬는데 같이 사용하고 있습니다. 재구매 하려구요~,1
849,"가볍게 각질제거가 되면서 피부가 촉촉해져요~
가격도 저렴하게 구입하고 배송도 빠르고 좋네요~^^",1
850,청보리 토너 써보고 좋아서 또 주문했어요! 이거 쓴 이후로 턱드름 안나요!!배송 완전 빨라요,1
851,건조함 잡아주는 촉촉함이어서 만족합니다. 여름이어서 로션제형은 부담스러운데 토너 하나만으로 해결이 되니 좋으네요. 재구매의사 있습니다.,1
852,"각질제거가 잘 되는지는 모르겠어요
기대하고 계속 사용해볼랍니다
이주일짼데 매일사용하진않아서인지
모르지만 아직까지는 효과 미비해요",1
853,"처음 써보니 제품인데 세일해서 사봤어요
순하면서도 피부가 정돈되는 느낌이네요",1
854,"닦토가 피지에 효과적이라고 해서 샀어요,
처음 쓴 날은 입가가 조금 따갑더라구요",1
855,아직 잘모르겠는데 뭔가 정돈되는 느낌?이에요 꾸준히 써봐야알것같아용,1
856,매일 매일 썼더니 각질정리가 매일 조금씩 돼서 각질이 안 쌓여서 좋아요,1
857,"여름에쓰기좋아요
냉장고넣고 쓰니 더만족요
닦토로딱입니당~",1
858,자주 사용 안해서 아직도 잘 모르겠지만 편하게 쓰고있어요.,1
859,군더더기없는 패키징이좋아요. 용량이더컸으면좋겠어요,1
860,가성비 좋아서 구매했고 깔끔한 느낌이라 괜찮네요,1
861,토너 첨 사용해 보는데 자주 안쓰니 잘모르겠네요.,1
862,좋은거같은데 용량좀더 컷으면 좋겠어요ㅠㅠ,1
863,스킨 전에 사용하면 피부가 더 촉촉해요.,0
864,딸 주문해 주었는데 잘 사용하고 있네요,1
865,포장도 잘되어있고 제품도 만족합니다!,1
866,순하고 좋아서 항상 쓰는 제품이예요,1
867,촉촉한느낌과..빠른흡수..넘좋아요~,1
868,좋은것같아요~잘 사용하겠습니다,1
869,이상없이 잘되네요 감사합니다,1
870,장마철이라 너무 습해서 주문했어요. 완전 물제형이라 무겁지 않고 좋아요,1
871,여름에 쓰기 좋은 토너같아요,1
872,좋아요! 저렴하게 잘 샀어요!,1
873,항상 믿고 쓰는 제품입니다,1
874,순하고 매일 쓰기에 좋아요,1
875,가볍게 닦토하기 좋아요,1
876,"이번에 토너를 바꿀 기회가 생겨서 믿고사는 이니스프리로 바꿔봅니다 한번 써보고 괜찮으면 이것만 구매할게요 많이파세요(사용 후 벌점 바뀔수도 있어요, 아직 사용전, 글도 수정할겁니다)",1
877,보통,1
878,"번들거림 없이 촉촉하게 잘 스며들어요
조금 더 써봐야 하겠지만
오지마자 오픈해서 이틀 사용한 결과는
만족스러운 편이예요!",1
879,나쁘지 않았습니다 근데 트러블개선은 기대만큼은 아닌것 같습니다,1
880,더 써봐야 알겠지만 좋은거같아여 배송하나는 진쫘~~~빠르네요!,1
881,"화장솜에 붇혀 닦아내는 용도로 쓰려고 구입했어요
세안후 닦아내고 어떤때는 좀 많이 적셔 붙여서 수분충전해주는데
향도 거의없고 순해서 좋습니다",1
882,잘사용하고있어요 촉촉하고좋아요,1
883,"배송은 빠른 편이고 가격도 적당하게 구매한거 같아요.
바르니 순하고 좋은 거 같습니다.",1
884,"아침에 꼭 이걸로 관리합니다, 용량도 넉넉하고 생각보다 자극이 적은거같아서 좋아요",1
885,딱 무난하게 사용하기 좋아요! 가격도 저렴한데 성분도 착하고 제품력도 괜찮고ㅜㅜ,1
886,아직 한 번밖에 안 써서 잘 모르겠지만 자극도 별로 없고 괜찮은 거 같아요,1
887,꾸준히 쓰면서 번들거림도 없고 트러블도없어서 너무좋앗어요 ㅎㅎ,1
888,이니스프리 순해서 좋아하는데 청보리 토너도 역시 순하고 좋아요. 촉촉합니다. 같이 받은 화장솜에 적셔 사용 중입니다.,1
889,"지복합성 피부인데, 닦토로 사용하는데 끈적임이 없어 좋네요^^",1
890,"아직 많이 안써서 모르겠지만
시원하고 촉촉해요!
잘쓰겠습니당",1
891,"배송도 정확하고, 택포로 이정도면 되게 저렴하게 구매했어요.",1
892,"500ml검색해서 그 카테고리에 나오길래
몇미리인지 확인도 안하고 걍 주문했더니 250ml였네요 ㅠ 자세히 보고 살껄..후회중",1
893,상당히 괜찮은것같습니다. 근데 다른데보다 비싸요,1
894,"닦토용으로 구매했구요, 가끔 스킨ㅇ에 묻혀 묽은팩으로도 사용 합니다.
저는 워낙 평소에도 트러블 없는 피부라 아무거나 사용하긴 하는데 가격도 착하고 좋아요 ㅎㅎ
다떨어지면 구매 또 할거같아요",1
895,이니스프리늘만족하며쓰고있습니다 순해요,1
896,순하고 각질정리에 도움이 많이 돼요,1
897,산뜻하고 가볍게 사용하기 좋습니당,1
898,트러블이 가라앉았어요 너무 좋네요,1
899,"촉촉 깔끔
좋아요 자극적이지도않고",1
900,순해서 좋아요! 저렴하게 샀어요!,1
901,아직 사용 전이지만 기대합니다,1
902,아주 잘쓰고 있습니다~~~~~~~~~,1
903,착한성분 이니스프리 좋아요,1
904,무난하게 쓰긴 괜찬습니다,1
905,기본스킨으로는 짱입니다.,1
906,학생용으옾좋어요. ㅎㅎ,1
907,항상 주문합니다 좋아요,1
908,자극없고 닥토로 좋아요,1
909,빠른배송 좋은품질 굿굿,1
910,순해서 좋습니다~ 토너라 자극이있을까봐 걱정이였는데 아침저녁으로 잘쓰고있습니다.,1
911,닦토에가성비짱입니다,1
912,가볍게 잘 발려요 ㅎ,1
913,"피부 자극없이 순합니다.
양도 많고 맘에 듭니다.
다 쓰고 재주문 할게요~^^",1
914,효과는 아직 잘 모르겠고 입주변에 닿으면 화끈화끈해요,1
915,중학생 아들 얼굴에 올라온 여드* 케어용으로 샀는데 일단 만족해요. 화장솜 적셔서 올려두니 좀 진정된 느낌이에요.,1
916,저렴해서 닥토로 사용하기 딱인거 같아요. 끈적임없고 물같아요,1
917,원래 이 제품은 밀봉이 안되어 있는건가요? 화장품인데 뚜껑 따자마자 바로 토너가 나와서 깜놀했네요 ㄷㄷ,1
918,세수하고 바르면 화한 느낌이 나는데 이게 자극이 없는건지는 잘 모르겠어요 열심히 써보겠습니다,1
919,이니스프리 성분도 다 괜찮아서 구매했는데 바르니까 시원해요 각질을 정돈해줘서 그런지 바르면 청량감같은게 느껴져요,1
920,청보리 토너 너무 순하고 개운하고 보습감도 있어서 듬뿍 듬뿍 사용 잘 하게됩니다 이니스프리 좋은제품 감사해요 자주 애용할 데일리템 쟁여둡니다,1
921,항상 쓰는 제품인데 저렴하게 구매해서 좋았어요 그런데 배송비는 따로 붙더라고요 그래도 다른 곳 보다 저렴해요,1
922,매일사용해도 되는지 모르겠는데 좋다고 해서 구매했어요. 처음 사용했는데 닦아서 남은건 흡수시켜달라고 했는데 흡수시킬게 없어요 좀 건조해요. 필링토너라 효과있었음 좋겠네요,1
923,배송도 빠르고 좋아요~ 친구꺼 써봤는데 괜찮은거같아서 구매했어욤🥰,1
924,"닦토로 사용중인데 여름철에 쓰기 딱좋아요
가볍고 화해서 시원해요",1
925,지성피부인데 확실히 유분기를 오래 잡아주네요 만족합니다 ㅎㅎ,1
926,무지 빨리 도착했어요~ 저렴하고 가성비 좋은 토너 같네요 ㅎㅎ,1
927,잘 받았습니다. 싸게 잘 구입한 거 같네요~ 최근 제조한거라 유통기한이 넉넉합니다~ 잘 쓸게요~^^,1
928,향이 순하고 보습도 양도 만족스러워 계속사용중입니다.,1
929,간단하게 아침에 닦토용으로 사용하기 괜찮을것같아요,1
930,믿고쓰는이니스프리 뭘써도실패한적이없는듯해요~~,1
931,매번 사용하는 제품 저렴하게 구매해서 좋아요!,1
932,시원하고 좋아요 케어가 잘 되었으몀 좋뎄어요,1
933,토너가필요한데마침세일해서어서구매했어요,1
934,닦토로 쓰고있는데 순하고 무난해서 좋아요!,1
935,잘받았습니다 . 써보고 한달후기남길게요,1
936,항상 쓰는 제품인데 너무 좋아요 ㅎㅎ,1
937,각질제거에 좋아요. 쟁여놓고 씁니다,1
938,잘받았어요 쓰기 전민데 기대되네요,1
939,이니스프리는 항상 사랑입니다 최오,1
940,가벼운 농도인데 촉촉함이 오래가요,1
941,형이 좋아서 구매했어요 잘 쓸게요,1
942,상자가 다 찌그러져서 왔어요.,1
943,가격도 착하고 효과도 좋네요.,1
944,촉촉하고생각보다좋은듯,1
945,배송 빨라서 넘 좋네요,1
946,만족해요...,1
947,그냥그냥 괜찮아요 촉촉하진 않아요,1
948,여름에는 지성피부가 되는 복합성인데 각질제거도 되면서 건조하지도 않아 좋아요. 닦토 중 가장 잘 맞는 것 같아서 재구매했어요.,1
949,처음 써보는데 너무 산뜻하고 좋았어요! 배송도 빨랐구요 앞으로 여름엔 이제품만 쓸거같네요!!,1
950,벌써 이만큼 썼어요. 필링 토너라기에 자극이 있을까 했는데 자극은 없으면서 각질 관리만 되네요. 재 구매의사 있습니다.,1
951,"워낙 유명템이라서~ 구매해보았습니다.
자극이 전혀없어요~ 각질 관리는 좀 더 써봐야 알것같아요~
순한 제품입니다~",1
952,홍조가 있는데 순하고 트러블이 없어요. 안심하고 사용하고 있어요. 좋아요,1
953,"이제 처음써봐서 잘모르겟으나
첫날쓰고 약간 건조하다는 느낌 받앗습니다
저는 지성이라 잘 맞는것같으나
좁쌀여드름 부위쪽 각질탈락은 좀더 써봐야 알것같습니다",1
954,아직 며칠안써서 트러블에 도움이 되는지는 모르겠는데 일단 사용감은 좋아요,1
955,"촉촉그자체 끈적임no

화장솜에 묻혀 닦아내주고 에센스바르기좋아요",1
956,좋다고해서샀어요 아직잘모르겟는데 피부에잘맞는거같아요,1
957,"자극없고, 순하고, 피부결이 좀 정돈되는 느낌이에요~",1
958,쓰던 아이라 할인기간에 샀어요. 자극도 별로 없고 끈적하지도 않아서 좋아요 ㅎㅎㅎ,1
959,순하고 양도 많아서 항상 쓰고 있어요,1
960,매번 쓰는건데 싸게 잘산거 같아요~,1
961,샘플사용해보고 좋아서 주문했어요,1
962,열통째 사용중이에요 너무 좋앙ㅅ,1
963,"시원하구 좋아용
향은 전혀없네요",1
964,아직은 더 써봐야겠지만 좋네요,1
965,배송빠르고 매번쓰는거에요,1
966,빠르게 잘받았습니다 굿굿,1
967,항상 사용마는 제품입니다,1
968,계속 쓰는 제품이에요. 굿,1
969,향이 순하고 깨끗합니다,1
970,싸게 잘사서 쓰고있어요,1
971,무난한 제품이에요.,1
972,순하게 쓰기 좋네요,1
973,여드름땜에 구매해봤어요 얼굴 번들거릴때 닦으니까 좋았어요,1
974,이렇게 밀폐없이 그냥 뚜껑만 달려있는 화장품은 처음이네요. 새제품 맞는지 의문이...상품평이 많길래 호기심에 샀는데 특별히 좋은건 모르겠어요,1
975,순한거 같긴합니다만 계속 써봐야 알거같습니다~!,1
976,청보라 진정 성분이 많다고해서 지인추천으로 구매했는데 용량 짐승용령입니다 토너로 사용하기 좋아요 코튼솜에 적셔서 얹어 놓고 지긋히 닦토하는 용도로 사용 잘 하고 있습니다 다 쓴다면 재구매 의사 있습니다,1
977,전부터 늘 쓰는 청보리 토너입니다. 닥토용으로 주로 쓰고 있는데 자극도 별로 없고 촉촉해서 재구매 하고있어요!,1
978,아이소이 pha 토너 보다 자극 덜해서 다시 사서 쓰고 있어요ㅎㅎ 순해요,1
979,성분이 착해서 사용중인데 피부 트러블이 줄어드는것 같아요,1
980,아직 몇주 안써봤지만 2주동안 써본 결과 매우 좋아요!,1
981,필링이 잘 되고 생각보다 촉촉한 스타일은 아니예요!,1
982,항상 쓰는 제품인데 저렴하게 잘 산 것 같아요😊,1
983,냉장고 넣어놧다가 스킨팩 하면 아주 시원하고 모공이 깨끗하지는 느낌이 나요 시원한 자극이 있고 진정되는 느낌이 있습니다,1
984,그냥 그래요 타제품에비해서 좋은지 모르겠어요,1
985,닥토로 사용하는데 다 써가서 새로 구매했어요.,1
986,효과있는거 같아요 피지가 점점 빠져가는 느낌,1
987,스킨이라 촉촉한 느낌있고 각질관리에 좋아요,0
988,닦는 용도로 좋아요 용량도 많고 순해여,1
989,"세안후 닦으려고 샀는데
깔끔하네요",1
990,가성비 만족입니다. 좋으네요.,1
991,잘 모르겠습니다 그냥 그래욥,1
992,딸래미가 사옹하려고 샀어요.,1
993,자극도 없고 아주 좋습니다~,1
994,기대됩니다 빨리 후기르레,1
995,쓰던 제품이에요 좋아요,1
996,아직 안써봤지만 기대중,1
997,"가성비가 괜찮네요 ㅎㅎ
무겁지 않고 가벼운 느낌이에요 !
나쁘지 않아요 ㅎㅎ 근대 효과가 엄청 좋은지는 잘 모르겠네요
그래도 잘 사용하고 있어요~
재구매는 좀 더 고려 해봐야겠네요.",1
998,오 구매확정 못했는데,1
999,촉촉하고 무난해요:),1
1000,저렴하게 구매!!!!!!,1
1001,피부에 자극없이 순하고 부드러워서 사용하고 만족하여 재구매,1
1002,지금 벌써 세 통인가 네 통째 쓸 정도로 잘 쓰고 있습니다. 수부지 피부에 부담없이 좋은 것 같아요.,1
1003,"세일 하길래 샀는데,막 쓰기에 좋은거 같아요.산뜻한감은 있어요.근데,조금 건조한 느낌?",1
1004,한번사용해봐서 아직 효과는 잘 모르겠지만 수분감은 적당히 좋은것 같아요,1
1005,팍팍 쓰기좋아요 ㅎㅎ 세일할때저렴하게 구매해서만족합니더,1
1006,"이건 언제써도 좋아요
세수한거마냥 피부가 개운하고 각질이생겼던것도 이거쓰면
언제 생겼냐는듯이 사라져요",1
1007,닦고 나면 좀 화한 느낌이 있는데 아프진 않아요,1
1008,원래 쓰는 제품이 다 떨어져서 또 구매했습니다,1
1009,3개째쓰는 필링토너입니다순하고 괜찮아요,1
1010,이니스프리는 믿고 쓰고 다양해서 좋아요.,1
1011,각질정리가 잘되서 좋아요 촉촉합니다,1
1012,무향이고 데일리하게 쓰기 좋넹ㅛ,1
1013,저렴해서 샀네요~ 괜찮겠죠~,1
1014,자극은 없으나 향은 없어요,1
1015,세안후 스킨흡수가 좋아요,0
1016,재구매입니다. 제품이 순한편입니다.,1
1017,청량한 느낌의 토너예요,1
1018,굿굿굿 좋아요 굿굿굿 좋아요,1
1019,가격대비 만족합니다.,1
1020,스킨전에 바르니까 촉촉하네요. 따로 각질제거 할 필요없을 것 같네요.,1
1021,"좋아요~~
무난하고 자극적이지 않습니다 ㅋㅋ 잘 사용하고있어요",1
1022,"직장에서 수정화장할때 쓰면 좋아요
쓰던거 저렴하게 사서 좋아요ㅎㅎ",1
1023,"닦토로 딱 좋아욯ㅎㅎㅎ 순하고 각질제거도 어느정도 되는 거 같고,,,순하게 잘 사용하고 있어요",1
1024,만족만족 굿굿 촉촉,1
1025,좋아용! 완전 재구매 의사 있구요~ 지금 한 통 다써가서 다시 또 구매하려구요! 눈에 들어가도 안 따갑고 닦토로 사용하기에 너무 좋네요?ㅎㅎ 매일매일 사용하고 있는데 한동안 계속 쓸것 같아요~,1
1026,"처음 사서 사용해 봤는데 양도 많고 피부 발림도 괜찮은 것 같습니다
무향무취라서 거부감도 없습니다.
세안 후에 솜에 적셔서 엣센스 바르기전 얼굴을 닦아내는데 주로 사용합니다
향후 재구매 의사 있습니다",1
1027,제 피부에 맞는 토너가 잘 없어서 긴가민가하고 샀는데 깔끔하고 좋네요. 묽은 제형인데 사용할 때 줄줄 나오는 것도 아니라서 좋습니다. 사용기한도 넉넉합니다.,1
1028,"데일리 필링으로 적당한거 같아요
드라마틱한 효과는 잘 안느껴지지만 예민한 피부라 트러블 안나는 것만 해도 좋아요",1
1029,별로 나쁜것없이 무난하게 좋아요! 닦토치고 촉촉함이 더 남는 것 같다고 느꼈어요.,1
